Title,Company,Salary,Location,Job Description,Job Requirements,Date Posted,Industry,Field,Experience,Education,Age,Vacancy,Work Time,Level,Skills,Language,Nationality,Gender,Marital Status,Work Date,Work Type,Keyword
Supply Chain Manager,A France Pharmaceutical Company,Thương lượng,"186 Nguyễn Văn Hưởng, Thảo Điền, Quận 2, Thành phố Hồ Chí Minh, Việt Nam, 186 Nguyễn Văn Hưởng, Thảo Điền, Thủ Đức City, HCMC","1. Supply Chain Management | Quản lý Chuỗi cung ứng
1.1 Demand Supply Planning | Lập kế hoạch cung ứng nhu cầu:
- Review historical sales trends, research demand drivers, prepare forecast data, develop statistical forecast models, and evaluate forecast results.
Xem xét các xu hướng doanh số trong quá khứ, nghiên cứu các yếu tố thúc đẩy nhu cầu, chuẩn bị dữ liệu dự báo, phát triển mô hình dự báo thống kê và đánh giá kết quả dự báo.
- Manage interfaces with sales & marketing for demand (supply) planning, inventory planning, product delivery, and new product follow-up.
Quản lý mối liên hệ với đội ngũ bán hàng và tiếp thị về lập kế hoạch cung ứng, quản lý tồn kho, giao hàng và theo dõi sản phẩm mới.
- Ensure supply plans are processed on time and appropriately.
Đảm bảo các kế hoạch cung ứng được thực hiện kịp thời và phù hợp.
- Ensure consistency of data, provide input trend analysis.
Đảm bảo tính nhất quán của dữ liệu và cung cấp phân tích xu hướng đầu vào.
- Work closely with suppliers and stakeholders to ensure forecasts are met.
Làm việc chặt chẽ với nhà cung cấp và các bên liên quan để đảm bảo đáp ứng dự báo.
1.2 Inventory Management | Quản lý Tồn kho:
- Ensure healthy inventory levels with minimal slow-moving and obsolete stocks.
Đảm bảo mức tồn kho lành mạnh, giảm thiểu hàng tồn chậm và lỗi thời.
- Manage and review slow-moving and obsolete reports.
Quản lý và đánh giá các báo cáo về hàng tồn chậm và lỗi thời.
- Work with stakeholders to maintain product availability and delivery service.
Làm việc với các bên liên quan để đảm bảo sẵn có sản phẩm và dịch vụ giao hàng.
1.3 Shipment Tracking | Theo dõi Giao hàng:
- Follow up with suppliers/3PL and track shipment schedules.
Theo dõi lịch trình giao hàng với nhà cung cấp/đơn vị giao nhận.
1.4 Customs Procedures | Thủ tục Hải quan:
- Work with forwarders and customs officers for customs declaration, inspections, duties, and tax issues.
Làm việc với đơn vị vận chuyển và hải quan để khai báo hải quan, kiểm tra, xử lý thuế và các vấn đề thuế quan.

2. Purchasing Responsibilities | Trách nhiệm Mua hàng
2.1 Processing Orders | Xử lý Đơn hàng:
Receive and process orders, primarily from the Marketing department.
Tiếp nhận và xử lý các đơn đặt hàng từ phòng Marketing.
2.2 Vendor Coordination | Phối hợp với Nhà cung cấp:
Negotiate terms, place orders, and ensure timely delivery.
Làm việc với nhà cung cấp để đàm phán điều khoản, đặt hàng và đảm bảo giao hàng đúng hạn.
2.3 Order Approval | Trình ký Đơn hàng:
Present orders for approval and ensure proper documentation.
Trình ký đơn hàng và đảm bảo tài liệu liên quan được phê duyệt.
2.4 High-Value Orders | Đơn hàng Giá trị cao:
Follow proper procedures for orders exceeding 20 million VND.
Tuân thủ quy trình cho các đơn hàng có giá trị trên 20 triệu VND.","1. Educational Qualifications
• Tốt nghiệp Đại học chuyên ngành Quản trị Kinh doanh, Quản lý Chuỗi cung ứng hoặc các ngành liên quan.
Bachelor’s degree in Business Administration, Supply Chain Management, or a related field.
2. Experience
• Có ít nhất 3-5 năm kinh nghiệm trong lĩnh vực cung ứng, xuất nhập khẩu, với ít nhất 2 năm ở quản lý.
Minimum 3-5 years of experience in supply chain, import, export, purchasing roles, with at least 2 years in a management level.
3. Competencies
• Demand & Supply Planning | Lập kế hoạch cung ứng và nhu cầu:
- Ability to analyze historical sales data, forecast demand, and build forecasting models to ensure supply aligns with demand.
Khả năng phân tích dữ liệu bán hàng lịch sử, dự báo nhu cầu, và xây dựng các mô hình dự báo để đảm bảo cung ứng phù hợp với nhu cầu.
• Inventory Management | Quản lý tồn kho:
- Efficient inventory management, ensuring healthy stock levels, minimizing slow-moving and obsolete stock, optimizing resources.
Quản lý tồn kho hiệu quả, đảm bảo mức tồn kho lành mạnh, giảm thiểu hàng tồn chậm và lỗi thời, tối ưu hóa nguồn lực.
• Logistics & Shipment Tracking | Theo dõi lô hàng và logistics:
- Ability to track and manage shipment processes, coordinating with suppliers and logistics providers.
Khả năng theo dõi và quản lý quy trình giao hàng, điều phối với nhà cung cấp và đơn vị vận chuyển.
• Customs & Import Procedures | Thủ tục hải quan và nhập khẩu:
- Knowledge of customs procedures, tax regulations, and import laws, ensuring timely and accurate processing.
Hiểu biết về quy trình hải quan và các quy định về thuế, nhập khẩu, đảm bảo thủ tục được xử lý chính xác và kịp thời.
• Purchasing & Vendor Management | Mua hàng và quản lý nhà cung cấp:
- Effective purchasing capabilities, negotiating with suppliers, and ensuring procurement compliance, particularly for high-value orders.
Năng lực mua hàng hiệu quả, đàm phán với nhà cung cấp, và đảm bảo quy trình mua sắm được tuân thủ, đặc biệt với các đơn hàng giá trị cao.
4. Additional Requirements
• Fluency in English and Vietnamese communication
Thành thạo kỹ năng giao tiếp bằng tiếng anh và tiếng việt",18/05/2025,Hậu Cần/Xuất Nhập Khẩu/Kho Bãi > Quản Lý Chuỗi Cung Ứng,Dược phẩm,3,Cử nhân,Không hiển thị,1,08:30 - 17:30,Trưởng phòng,"English Fluency, Inventory Management, Logistics Control, Supply Chain Management, Supply Planning",Tiếng Anh,Người Việt Nam,Bất kỳ,Bất kỳ,T2 - T6,Toàn thời gian,"Hậu Cần/Xuất Nhập Khẩu/Kho Bãi, Quản Lý Chuỗi Cung Ứng, Dược phẩm, English Fluency, Inventory Management, Logistics Control, Supply Chain Management, Supply Planning, A France Pharmaceutical Company, Hồ Chí Minh"
Trợ Lý Kinh Doanh,Công Ty TNHH VB Viko,Từ $ 250 /tháng,"Tòa Nhà Chung Cư Vườn Xuân, 71 Đường Nguyễn Chí Thanh, Láng Hạ, Ba Đình, Hà Nội, Việt Nam, Toà nhà Vườn Xuân, 71 Nguyễn Chí Thanh, Đống Đa, Hà Nội.","- Ưu tiên những bạn trẻ có ước mơ phát triển bản thân và có định hướng rõ ràng: Trở thành trưởng phòng kinh doanh sau 3-5 năm, đạt được vị trí phó giám đốc sau 7-10 năm
- Ưu tiên những bạn trẻ có mong muốn khởi nghiệp, có mơ ước được vươn tới những vị trí đứng đầu trong tổ chức, dám nghĩ, dám trách nhiệm và dám lăn xả.
- Công việc chào đón các bạn mới ra trường, chưa nhiều kinh nghiệm và sẽ được đào tạo các nghiệp vụ: Kế toán, Tài chính, xuất nhập khẩu, quản trị dự án.
- Cọ sát trực tiếp đối tác khách hàng và nhà cung cấp
- Trực tiếp tham gia triển khai thực hiện công việc của các bộ phận nội bộ .
- Lập các báo cáo số liệu liên quan tới kết quả kinh doanh.
- Đối soát sổ sách chứng từ, sổ sách kế toán, kết quả kinh doanh.","- Ngoại hình tốt.
- Điểm cộng với các ứng viên tốt nghiệp chuyên ngành Tài chính, hoặc những ứng viên có điều kiện tài chính tốt và muốn khởi nghiệp / muốn phát triển sự nghiệp theo hướng chủ động, tinh thần làm chủ, làm người lãnh đạo trong tương lai.
- Có khả năng di chuyển công tác trong và ngoài nước theo yêu cầu công việc.
- Ưu tiên người có khả năng sử dụng từ 2 ngoại ngữ trở lên.
- Tốt nghiệp Đại học trở lên các chuyên ngành về: Luật, Kinh tế, Tài chính, Quản trị kinh doanh, xuất nhập khẩu....
- Có khả năng làm việc ở cường độ cao và chịu áp lực tốt.",18/05/2025,Kinh Doanh > Bán Hàng/Phát Triển Kinh Doanh,Nhập khẩu/Xuất khẩu,Không yêu cầu,Không giới hạn,20-30,2,,Thực tập sinh/Sinh viên,"Tài Chính, Kinh Doanh",Bất kỳ,Không giới hạn,Bất kỳ,Bất kỳ,,Toàn thời gian,"Kinh Doanh, Bán Hàng/Phát Triển Kinh Doanh, Nhập khẩu/Xuất khẩu, Tài Chính, Kinh Doanh, Công Ty TNHH VB Viko, Hà Nội"
"Họa Viên 3D Kiến Trúc, Nội Thất - 3D Artist",Siri Interior,"$ 400-1,000 /tháng","49 Hoa Sứ, Phường 7, Quận Phú Nhuận, Hồ Chí Minh, 49 Hoa Sứ, Phường 7, Quận Phú Nhuận, Hồ Chí Minh","MÔ TẢ CÔNG VIỆC:

Diễn họa tốt kiến trúc, nội thất với ánh sáng ban ngày và ban đêm một cách sinh động, có chiều sâu

Dự án thị trường Mỹ và quốc tế

Dựng hình kiến trúc nội thất, furniture bằng 3ds Max

Thiết lập vật liệu, ánh sáng và render bằng V-Ray

Hậu kỳ hình ảnh bằng Photoshop

Phối hợp cùng team thiết kế để hoàn thiện sản phẩm đúng tiến độ và chất lượng","YÊU CẦU:

Có bằng cấp liên quan đến kiến trúc hoặc nội thất, hoặc đã được đào tạo qua các lớp kiến trúc/nội thất về đọc hiểu bản vẽ thiết kế

Thành thạo 3ds Max, V-Ray, Photoshop

Có kinh nghiệm dựng hình và diễn họa nội – ngoại thất, vật liệu, ánh sáng

Ưu tiên ứng viên đã học qua các lớp diễn họa 3ds Max – V-Ray nâng cao

Biết sử dụng AutoCAD, SketchUp là lợi thế (chủ yếu dùng để import/export file)

Tư duy thẩm mỹ tốt, cẩn thận, đúng deadline, chủ động trong công việc

QUYỀN LỢI:

Làm việc với dự án quốc tế chất lượng cao

Môi trường chuyên nghiệp, sáng tạo, thân thiện

Thu nhập cạnh tranh, thưởng theo hiệu quả và đóng góp

Cơ hội nâng cao kỹ năng chuyên môn, phát triển lâu dài

Hỗ trợ khi phải làm thêm giờ theo tiến độ dự án",18/05/2025,Kiến Trúc/Xây Dựng > Thiết Kế Kiến Trúc/Họa Viên Kiến Trúc,Kiến trúc/Thiết kế nội thất,Không yêu cầu,Không giới hạn,Không hiển thị,Không hiển thị,,Nhân viên,"V-Ray, Thiết Kế 3Ds Max, HỌA VIÊN KIẾN TRÚC, 3D Architectural Rendering, 3D Rendering",Bất kỳ,Không hiển thị,Không hiển thị,Không hiển thị,,Toàn thời gian,"Kiến Trúc/Xây Dựng, Thiết Kế Kiến Trúc/Họa Viên Kiến Trúc, Kiến trúc/Thiết kế nội thất, V-Ray, Thiết Kế 3Ds Max, HỌA VIÊN KIẾN TRÚC, 3D Architectural Rendering, 3D Rendering, Siri Interior, Hồ Chí Minh"
Receptionist,Md Dermatics Vietnam Co Ltd,$ 420-550 /tháng,"55 Ho Hao Hon, Co Giang ward, Dist.01, HCMC, 15 Vo Van Kiet, Ward 16, Dist. 08, HCMC, 15 Vo Van Kiet Street, Level 8, Ward 16, District 8","1. RECEPTION:

Answer incoming calls:
- Receive all incoming calls/ fax then forward calls to the appropriate person
- Take and deliver the message accurately and completely

Welcome guests & monitor security:
-Welcome guests/ vendors/ candidates/,… and direct to appropriate person
- Monitor people coming and going through the reception doors

Manage mail:
- Receives, sorts and distributes incoming mails & packages
- Manages and applies postage to outgoing mails & packages for pick-up or courier
- Check status of shipment if any

Photocopy service:
- Receives, sorts and applies deliver to service""
Meeting room arrangement:
- Maintain tidy and clean meeting rooms and announce the tea lady to prepare water, stationery if any""

General office duties:
- Keep Reception area clean and neat
- Work with tea lady to fill paper, stock workroom supplies, maintain conference room.
- Coordinate with MCs and artists to ensure the program goes as planned
- Participate in meetings to discuss ideas with other departments for holding the event
- Register in & out goods, delivery products and contractor into the building if any","- Can work on Sunday.
- 1-2 years of working in reception field.
- Proficient in Microsoft Office, especially in MS Excel.
- Good communication skills in English is a plus.",18/05/2025,Hành Chính Văn Phòng > Lễ Tân/Tiếp Tân,Bán lẻ/Bán sỉ,1,Không giới hạn,Không hiển thị,Không hiển thị,,Nhân viên,"Lễ Tân, Hành Chính Lễ Tân, Guest Welcoming, Answering Phone Calls, English Verbal Communication",Tiếng Anh,Người Việt Nam,Nữ,Không hiển thị,,Toàn thời gian,"Hành Chính Văn Phòng, Lễ Tân/Tiếp Tân, Bán lẻ/Bán sỉ, Lễ Tân, Hành Chính Lễ Tân, Guest Welcoming, Answering Phone Calls, English Verbal Communication, Md Dermatics Vietnam Co Ltd, Hồ Chí Minh"
Trưởng Phòng Marketing (Marketing Manager) - lĩnh vực BĐS,Công Ty Cổ Phần Đầu Tư Tập Đoàn Bee Group,Thương lượng,"Bình Thạnh, Hồ Chí Minh, Vietnam, Nguyễn Hữu Cảnh, Phường 22, Quận Bình Thạnh","1. Xây dựng , triển khai, theo dõi và cập nhật kế hoạch Marketing triển khai cho từng dự án theo từng giai đoạn bán hàng.
2. Quản lý và phân bổ ngân sách marketing cho các dự án.
3. Quản lý và điều phối các đơn vị cung cấp dịch vụ marketing.
4. Quản lý đội ngũ Marketing của Chủ đầu tư (Event, PR, Digital MKT, Graphic design) để thực hiện:
* Thiết kế ấn phẩm truyền thông... để hỗ trợ hoạt động kinh doanh.
* Quản lý kênh truyền thông số, triển khai chiến dịch Digital Marketing.
* Tổ chức các sự kiện bán hàng, khai trương nhà mẫu, kick-off dự án.
* Quan hệ báo chí, truyền thông, phóng viên để xử lý khắc phục các vấn đề liên quan đến truyền thông của dự án và tập đoàn.
5. Theo dõi, đo lường, phân tích hiệu quả marketing và báo cáo kết quả định kỳ.
6. Thực hiện các công việc theo chỉ đạo trực tiếp từ Giám đốc S&M","* Ít nhất 5 năm kinh nghiệm làm việc trong lĩnh vực Marketing lĩnh vực BĐS (yêu cầu bắt buộc), 3 năm ở vị trí quản lý trở lên.
* Tốt nghiệp Đại học chuyên ngành Marketing, Quản trị kinh doanh hoặc các ngành liên quan.
* Có khả năng phân tích thị trường.
* Hiểu biết sâu rộng về các kênh marketing online và offline. Có kinh nghiệm sử dụng các công cụ marketing online như Google Analytics, Facebook Ads, Google Ads
* Kỹ năng phân tích tốt và biết cách triển khai dự án.
* Kỹ năng lãnh đạo, quản lý và làm việc nhóm hiệu quả.
* Kỹ năng giao tiếp, thuyết trình và đàm phán tốt.
* Khả năng sáng tạo, tư duy chiến lược và giải quyết vấn đề.
* Có hiểu biết và có khả năng ứng dụng AI cao vào trong quá trình làm marketing",17/05/2025,"Tiếp Thị, Quảng Cáo/Truyền Thông > Tiếp Thị",Bất Động Sản/Cho thuê,5,Cử nhân,29-43,1,08:30 - 17:30,Trưởng phòng,"Bất Động Sản, Digital Marketing, Marketing, Tiếp thị, Truyền thông - marketing",Bất kỳ,Không giới hạn,Bất kỳ,Bất kỳ,T2 - T6,Toàn thời gian,"Tiếp Thị, Quảng Cáo/Truyền Thông, Tiếp Thị, Bất Động Sản/Cho thuê, Bất Động Sản, Digital Marketing, Marketing, Tiếp thị, Truyền thông - marketing, Công Ty Cổ Phần Đầu Tư Tập Đoàn Bee Group, Hồ Chí Minh"
