Title,Company,Salary,Location,Job Description,Job Requirements,Date Posted,Industry,Field,Experience,Education,Age,Vacancy,Work Time,Level,Skills,Language,Nationality,Gender,Marital Status,Work Date,Work Type,Keyword
Chuyên Gia Kiểm Soát và Báo Cáo Rủi Ro Hoạt Động - QLRR - MSB - 3B451,Ngân Hàng Thương Mại Cổ Phần Hàng Hải Việt Nam (MSB),Thương lượng,"Hà Nội, ROX Tower, số 54A Nguyễn Chí Thanh, Hà Nội; 180 - 192 Nguyễn Công Trứ, Quận 1, Hồ Chí Minh","- Tư vấn cho lãnh đạo về kế hoạch và việc triển khai các công việc chuyên môn
- Cải tiến các phương pháp, công cụ kiểm soát rủi ro hoạt động, chú trọng sử dụng các công cụ tự động hóa báo cáo, phân tích dữ liệu, ứng dụng AI
- Tổ chức/ tham gia triển khai các chương trình/công cụ quản lý rủi ro hoạt động: RCSA, giám sát các hạn mức/chỉ số rủi ro hoạt động và các công cụ khác;
- Tổ chức phân tích nguyên nhân, đề xuất các biện pháp xử lý và biện pháp tránh lặp lại đối với các sự kiện rủi ro hoạt động trên toàn hệ thống;
- Tổ chức giám sát việc triển khai các hành động giảm thiểu rủi ro hoạt động của các đơn vị trên toàn hệ thống;
- Triển khai tự động hóa báo cáo, ứng dụng AI đối với các báo cáo; Tham gia các dự án cải tiến, hiện đại hóa hệ thống quản lý rủi ro;
- Có khả năng đào tạo, nâng cao năng lực sử dụng các công cụ tự động hóa báo cáo, phân tích dữ liệu, ứng dụng AI cho các thành viên trong team.
- Các nhiệm vụ khác được giao","- Tối thiểu 5 năm kinh nghiệm trong lĩnh vực Ngân hàng. Thành thạo về công cụ tự động hóa báo cáo, AI, phân tích data hoặc công nghệ thông tin là lợi thế.
- Am hiểu sâu rộng về các sản phẩm, dịch vụ của Ngân hàng
- Kiến thức sâu rộng về QLRR Hoạt động; Am hiểu về các quy định của Pháp luật Việt Nam và Quốc tế về Quản lý Rủi ro Hoạt động.

""QUYỀN LỢI KHI GIA NHẬP MSB
Lương thưởng hấp dẫn:
• Mức lương cạnh tranh so với thị trường và tương xứng với năng lực, sẽ được thương lượng khi ứng viên vượt qua vòng Phỏng vấn.
• Chế độ thưởng incentive/KPI và hoa hồng hấp dẫn, chi trả theo tháng, thu nhập không giới hạn (đối với nhóm vị trí bán hàng và một số vị trí đặc thù).
• Thưởng hiệu suất cuối năm từ 2 đến 5 tháng lương trung bình của năm, tùy theo kết quả đánh giá xếp loại.
Chính sách phúc lợi toàn diện:
• Bảo hiểm theo quy định pháp luật và bảo hiểm chăm sóc sức khỏe cao cấp cho cán bộ nhân viên MSB.
• Các chế độ phúc lợi đa dạng: giờ làm việc linh hoạt, nghỉ mát, nghỉ sinh nhật, nghỉ khai giảng năm học cho con,...
• Có chương trình vay với lãi suất ưu đãi cho CBNV.

Đào tạo và thăng tiến:
• Chương trình Đào tạo chuyên sâu, bài bản theo hướng chuyển đổi (Re_skill, Up_skill, New_skill), được biên tập tùy theo từng nhóm vị trí công việc.
• Được hướng dẫn và kèm cặp tận tình bởi các lãnh đạo, quản lý trực tiếp và chuyên gia trong ngành.
• Chương trình phát triển quản lý dành cho các nhân viên có tiềm năng, giúp họ chuẩn bị sẵn sàng cho các vị trí quản lý và lãnh đạo trong tương lai.
• Ưu tiên tuyển dụng cấp quản lý từ nhân sự nội bộ, tạo cơ hội thăng tiến cho nhân viên.

Môi trường làm việc chuyên nghiệp và văn hóa doanh nghiệp năng động:
• Thoải mái, thân thiện, đề cao tinh thần trách nhiệm, hỗ trợ lẫn nhau.
• Năng động, sáng tạo, khuyến khích đổi mới và học hỏi liên tục.
• Tôn trọng sự khác biệt, đề cao tinh thần làm việc nhóm và hợp tác hiệu quả.
• Nhiều hoạt động văn hóa, thể thao, giải trí sôi nổi, tạo môi trường làm việc gắn kết và vui vẻ.
• Nhiều năm liên tiếp được HR Asia vinh danh """"Nơi làm việc tốt nhất Châu Á"""" và Anphabe vinh danh """"Doanh nghiệp có nguồn Nhân lực hạnh phúc"""".
""",09/08/2025,Ngân Hàng & Dịch Vụ Tài Chính > Tuân Thủ & Kiểm Soát Rủi Ro,Ngân hàng,4,Cử nhân,Không hiển thị,Không hiển thị,,Nhân viên,"Quản Lý Rủi Ro, Databases",Bất kỳ,Không hiển thị,Không hiển thị,Không hiển thị,,Toàn thời gian,"Ngân Hàng & Dịch Vụ Tài Chính, Tuân Thủ & Kiểm Soát Rủi Ro, Ngân hàng, Quản Lý Rủi Ro, Databases, Ngân Hàng Thương Mại Cổ Phần Hàng Hải Việt Nam (MSB), Hà Nội"
Chuyên Gia Quản Lý Rủi Ro Thẻ và Dịch Vụ Ngân Hàng Số - QLRR - MSB - 3B450,Ngân Hàng Thương Mại Cổ Phần Hàng Hải Việt Nam (MSB),Thương lượng,"Hà Nội, ROX Tower, số 54A Nguyễn Chí Thanh, Hà Nội; 180 - 192 Nguyễn Công Trứ, Quận 1, Hồ Chí Minh","1. Kiểm soát rủi ro hoạt động Thẻ và Ngân hàng điện tử tại MSB
- Phối hợp với chức năng chính sách rủi ro hoạt động xây dựng, triển khai và định kỳ cập nhật các quy định, quy trình, hướng dẫn quản lý, kiểm soát rủi ro và phòng chống gian lận hoạt động thẻ và NHĐT và NHĐT, sản phẩm dịch vụ ngân hàng trên nền tảng số, thanh toán số
- Thiết lập các quy luật/nguyên tắc cảnh báo giao dịch gian lận hoặc các giao dịch thẻ và ngân hàng điện tử có nghi vấn. Thiết lập các báo cáo quản trị rủi ro giao dịch Thẻ và NHĐT, sản phẩm dịch vụ ngân hàng trên nền tảng số, thanh toán số tại MSB.
- Thực hiện đánh giá rủi ro Thẻ và NHĐT và đề xuất, giám sát các hành động giảm thiểu rủi ro.
- Quyết định/ phê duyệt phương án xử lý với các giao dịch rủi ro gian lận, giả mạo
- Điều tra, xác định nguyên nhân và xử lý các sự vụ rủi ro giao dịch thẻ giả, gian lận, lừa đảo ebank, ATM skimming, ATM bị tấn công, ...
- Kiểm soát, thẩm định, đánh giá hồ sơ trình xử lý rủi ro các sự vụ liên quan hoạt động thẻ, ATM/POS và các kênh/ dịch vụ thanh toán điện tử khác
- Kiểm soát báo cáo số liệu gian lận, giả mạo trong hoạt động thẻ, ATM/POS phát sinh.
- Phê duyệt phương án tư vấn, đánh giá trên khía cạnh quản lý rủi ro các yêu cầu từ các phòng/ban và chi nhánh.
- Đề xuất sáng kiến, tham mưu cho Giám đốc phòng

2.Giám sát, phân tích và cảnh bao rủi ro giao dịch Thẻ và Ngân hàng Điện tử
- Triển khai giám sát, kiểm tra giao dịch, thực hiện báo cáo giao dịch Thẻ và Ngân hàng Điện tử ...
- Cập nhật các xu hướng, thủ đoạn gian lân. Phối hợp xử lý các yêu cầu và các sự cố liên quan đến nghiệp vụ quản trị rủi ro Thẻ và Ngân hàng Điện tử
- Phân tích rủi ro và đề xuất phương án xử lý khắc phục, thu hồi rủi ro lỗi hệ thống Thẻ/ Ngân hàng Điện tử phát sinh
- Phối hợp với các phòng ban liên quan tra soát, nhận diện các giao dịch rửa tiền, xử lý lỗi hệ thống liên tới tới hoạt động Ngân hàng Điện tử

3. Kiểm soát tuân thủ quy định của tổ chức thẻ quốc tế (TCTQT) và Ngân hàng Nhà nước (NHNN) trong hoạt động phát hành và thanh toán thẻ và Ngân hàng Điện tử
- Kiểm soát báo cáo tình trạng tuân thủ của MSB đối với các quy định của Ngân hàng nhà nước và Tổ chức thẻ quốc tế
- Kiểm soát nội dung cập nhật các yêu cầu tuân thủ TCTQT hàng tháng tới các bên liên quan.
- Phân tích các quy định, yêu cầu liên quan tới hoạt động và hệ thống Ngân hàng Điện tử của NHNN và báo cáo thực trạng tuân thủ và đề xuất kiểm soát tuân thủ
- Đề xuất các sáng kiến, khuyến nghị, hành động giảm thiểu rủi ro và đảm bảo tuân thủ quy định, yêu cầu mới từ NHNN và TCTQT

4. Thực hiện các nội dung công việc khác theo phân công của lãnh đạo phòng
- Chịu trách nhiệm quản lý các mục công việc theo phân công của Giám đốc phòng.
- Hỗ trợ Giám đốc phòng quản lý công việc khi vắng mặt theo ủy quyền của GD phòng.
- Tham gia các dự án liên quan tới hệ thống sản phảm thẻ, dịch vụ công nghệ Ngân hàng điện tử. Thẩm định, đánh giá rủi ro các sáng kiến phát triển kinh doanh sản phẩm NHĐT, sản phẩm ngân hàng số
- Phối hợp thực hiện các báo cáo NHNN định kỳ và khi phát sinh
- Phối hợp các đơn vị xử lý tình huống sự vụ rủi ro liên quan tới hệ thống công nghệ lừa đảo, gian lận ....
- Đào tạo, hướng dẫn cán bộ chuyên viên chính/ chuyên viên QLRR HĐ Thẻ và Ngân hàng Điện tử
- Xây dựng tài liệu đào tạo và triển khai đào tạo nâng cao nhận thức QLRR Thẻ và Ngân hàng điện tử cho các phòng ban hoạt động thẻ liên quan để tăng cường kiểm soát rủi ro","- Kinh nghiệm chuyên môn: Tối thiểu 5 năm kinh nghiệm làm việc trong lĩnh vực hoạt động NHĐT, quản lý rủi ro hoạt động hoặc quản lý rủi ro thẻ
- Am hiểu về hoạt động ngân hàng
- Am hiểu hệ thống các văn bản, quy định của NHNN về hoạt động Thẻ và Ngân hàng Điện tử,
- Am hiểu về hệ thống các danh mục sản phẩmThẻ và Ngân hàng Điện Tử
- Hiểu biết và nắm vững các quy định, thông lệ của Ngân hàng nhà nước, các tiêu chuẩn bảo mật an toàn trong hoạt động Thẻ và ngân hàng điện tử
- An hiểu nguyên tắc hoạt động hệ thống công nghệ NHĐT, tiêu chuẩn kết nối...
- Năm vững về quy định, thông lệ của Tổ chức Thẻ Quốc tế, các tiêu chuẩn bảo mật an toàn thanh toán Thẻ, ATM/POS
- Hiểu nguyên tắc trong hoạt động thẻ, luồng giao dịch và tiêu chuẩn kết nối, chuẩn chi thanh toán thẻ
- Hiểu biết các xu hướng sản phẩm mởi, xu hướng rủi ro, gian lận, lừa đảo hiện tại.
- Hiểu biết về các sản phẩm dịch vụ ngân hàng Bán lẻ
- Hiểu biết quản lý rủi ro hoạt động trong Ngân hàng

QUYỀN LỢI KHI GIA NHẬP MSB
Lương thưởng hấp dẫn:
• Mức lương cạnh tranh so với thị trường và tương xứng với năng lực, sẽ được thương lượng khi ứng viên vượt qua vòng Phỏng vấn.
• Chế độ thưởng incentive/KPI và hoa hồng hấp dẫn, chi trả theo tháng, thu nhập không giới hạn (đối với nhóm vị trí bán hàng và một số vị trí đặc thù).
• Thưởng hiệu suất cuối năm từ 2 đến 5 tháng lương trung bình của năm, tùy theo kết quả đánh giá xếp loại.

Chính sách phúc lợi toàn diện:
• Bảo hiểm theo quy định pháp luật và bảo hiểm chăm sóc sức khỏe cao cấp cho cán bộ nhân viên MSB.
• Các chế độ phúc lợi đa dạng: giờ làm việc linh hoạt, nghỉ mát, nghỉ sinh nhật, nghỉ khai giảng năm học cho con,...
• Có chương trình vay với lãi suất ưu đãi cho CBNV.

Đào tạo và thăng tiến:
• Chương trình Đào tạo chuyên sâu, bài bản theo hướng chuyển đổi (Re_skill, Up_skill, New_skill), được biên tập tùy theo từng nhóm vị trí công việc.
• Được hướng dẫn và kèm cặp tận tình bởi các lãnh đạo, quản lý trực tiếp và chuyên gia trong ngành.
• Chương trình phát triển quản lý dành cho các nhân viên có tiềm năng, giúp họ chuẩn bị sẵn sàng cho các vị trí quản lý và lãnh đạo trong tương lai.
• Ưu tiên tuyển dụng cấp quản lý từ nhân sự nội bộ, tạo cơ hội thăng tiến cho nhân viên.

Môi trường làm việc chuyên nghiệp và văn hóa doanh nghiệp năng động:
• Thoải mái, thân thiện, đề cao tinh thần trách nhiệm, hỗ trợ lẫn nhau.
• Năng động, sáng tạo, khuyến khích đổi mới và học hỏi liên tục.
• Tôn trọng sự khác biệt, đề cao tinh thần làm việc nhóm và hợp tác hiệu quả.
• Nhiều hoạt động văn hóa, thể thao, giải trí sôi nổi, tạo môi trường làm việc gắn kết và vui vẻ.
• Nhiều năm liên tiếp được HR Asia vinh danh ""Nơi làm việc tốt nhất Châu Á"" và Anphabe vinh danh ""Doanh nghiệp có nguồn Nhân lực hạnh phúc"".",09/08/2025,Ngân Hàng & Dịch Vụ Tài Chính > Tuân Thủ & Kiểm Soát Rủi Ro,Ngân hàng,4,Không giới hạn,Không hiển thị,Không hiển thị,,Nhân viên,"Quản Lý Rủi Ro, Dịch Vụ Ngân Hàng Điện Tử",Bất kỳ,Không hiển thị,Không hiển thị,Không hiển thị,,Toàn thời gian,"Ngân Hàng & Dịch Vụ Tài Chính, Tuân Thủ & Kiểm Soát Rủi Ro, Ngân hàng, Quản Lý Rủi Ro, Dịch Vụ Ngân Hàng Điện Tử, Ngân Hàng Thương Mại Cổ Phần Hàng Hải Việt Nam (MSB), Hà Nội"
Supply Chain Manager (Fresh Products),Công ty TNHH Kamereo,Thương lượng,"Tầng 1 – Tòa nhà The Manor 1, 91 Nguyễn Hữu Cảnh, Phường 22, Quận Bình Thạnh, Thành phố Hồ Chí Minh, Việt Nam, F05&F06A Tầng 1 - Toà nhà The Manor Officetel, 89 Nguyễn Hữu Cảnh, Phường 22, Quận Bình Thạnh, TP Hồ Chí Minh","• Responsible for the end-to-end process from supplier sourcing, order placement, logistics solutions, and ensuring high-quality delivery to Kamereo’s warehouses.
• Oversee daily ordering and purchasing activities in the fresh products (veggie / non veggie) category, ensuring smooth operations within Vietnam.
• Develop and execute demand planning based on sales forecasts and historical data to maintain optimal stock levels for daily, weekly, and monthly needs.
• Manage a large portfolio of SKUs,ensuring accurate ordering and timely stock replenishment to support business growth.
• Negotiate pricing and payment terms to support cost efficiency and optimize cash flow.
• Monitor and secure KPIs including Out-of-stock rate, fill rate, Input cost, and other operational metrics.
• Continuously source and evaluate new suppliers to improve product quality and pricing competitiveness.
• Ensure suppliers deliver on time and in full to maintain operational consistency.
• Conduct regular market research to benchmark prices and ensure internal competitiveness.
• Review product portfolio performance and provide recommendations on removing or adding SKUs based on demand and efficiency.
• Work closely with the Operations team to resolve issues related to product quality, returns, and delivery timing.
• Conduct weekly warehouse visits to validate actual stock conditions and manage out-of-stock risks, quality, and expiration.
• Collaborate with the Accounting team on supplier contracts and outstanding debts.
• Build and maintain strong relationships with suppliers, ensuring long-term cooperation and alignment with sourcing strategy.
• Conduct on-site visits to evaluate supplier facilities, compliance, and operational capabilities.
• Provide quotations and product information to support the Sales team in customer pitches.
• Collaborate with Sales to prepare inventory for weekly and monthly promotional campaigns.
• Travel within Vietnam to supervise team performance and resolve sourcing-related issues.
• Proactively propose improvement initiatives (kaizen) to enhance procurement efficiency and competitiveness.
• Other tasks as assigned by the line manager and BOD.","• Minimum 5 years of experience in F&B sourcing & purchasing, focus on fresh products (veggie / non veggie).
• Strong experience working with large number of SKUs, ensuring product availability and variety.
• Solid experience in demand planning, supplier management, and cost control.
• Fluent English and deep understanding of the F&B market in Vietnam.
• Logical thinking, strong problem-solving skills, and effective communication.
• Excellent interpersonal, negotiation, and presentation skills.
• Self-motivated, results-driven, and eager to learn.",09/08/2025,Hậu Cần/Xuất Nhập Khẩu/Kho Bãi > Thu Mua & Quản Trị Hàng Tồn Kho,Chuỗi cung ứng,5,Cử nhân,Không hiển thị,1,9:00 - 18:00,Trưởng phòng,"Aggressive & Can Do Attitude, Demand Planning, Demand Planning, Demand Planning, Details Orientation, Details Orientation, English Fluency, Solution Focused",Tiếng Anh,Người Việt Nam,Bất kỳ,Bất kỳ,T2 - T6,Toàn thời gian,"Hậu Cần/Xuất Nhập Khẩu/Kho Bãi, Thu Mua & Quản Trị Hàng Tồn Kho, Chuỗi cung ứng, Aggressive & Can Do Attitude, Demand Planning, Demand Planning, Demand Planning, Details Orientation, Details Orientation, English Fluency, Solution Focused, Công ty TNHH Kamereo, Hồ Chí Minh"
Trưởng Ban Đào Tạo - Swinburne Việt Nam (Cơ Sở Đà Nẵng),Tổ chức Giáo dục FPT - FPT Education Đà Nẵng,Thương lượng,"2A Đường 2 Tháng 9, Phường Hải Châu, Đà Nẵng, KĐT FPT City, Hòa Hải, Ngũ Hành Sơn, TP Đà Nẵng","1. Truyền thông về các giá trị thương hiệu và đào tạo của Swinburne:
• Hiểu rõ về thương hiệu, các giá trị và sự khác biệt trong nội dung đào tạo và dịch vụ của Swinburne
• Tham gia thuyết trình, trả lời câu hỏi trong các buổi giới thiệu với phụ huynh, học sinh về các giá trị của Swinburne
• Phát hành các tài liệu truyền thông của Swinburne về đào tạo, dịch vụ sinh viên
• Tham gia phỏng vấn tuyển dụng sinh viên và truyền thông giá trị
• Phối hợp tổ chức truyền thông các giá trị đào tạo của Swinburne
• Tổ chức các hội thảo, các hoạt động nâng cao nhận diện thương hiệu và ảnh hưởng
• Hợp tác với các cơ quan ban ngành, doanh nghiệp của địa phương để phát triển kết nối doanh nghiệp và ảnh hưởng khu vực
2. Phối hợp với Swinburne Hà Nội hoặc Australia về triển khai chương trình đào tạo:
• Phối hợp với Swinburne Australia về tổ chức triển khai đào tạo tại Việt Nam
• Báo cáo định kỳ về các vấn đề quản lý chất lượng đào tạo
• Các hoạt động exchange và transfer đào tạo
• Các hoạt động hợp tác quốc tế về đào tạo: tổ chức hội thảo, hợp tác
3. Tuyển dụng Giảng viên và quản lý chất lượng đào tạo:
• Tuyển dụng giáo viên đảm bảo chất lượng để tổ chức triển khai đào tạo
• Theo dõi bảo đảm chất lượng đào tạo
• Nắm vững và theo dõi chặt chẽ các chỉ số KPIs về chất lượng đào tạo
• Tổ chức các hoạt động hỗ trợ đem lại chất lượng đào tạo cao cho sinh viên
• Đảm bảo xây dựng môi trường đào tạo quốc tế tại Swinburne
4. Tổ chức các hoạt động industry links (kết nối doanh nghiệp), OJT cho sinh viên:
• Trong từng môn học, nghiên cứu và phối hợp giáo viên để tạo các kết nối doanh nghiệp, các dự án thực tế cho sinh viên
• Tổ chức các hoạt động OJT (thực tập cho sinh viên)
• Mời các diễn giả bên ngoài để chia sẻ kinh nghiệm và truyền cảm hứng
5. Theo dõi và đảm bảo các dịch vụ đào tạo:
• Dịch vụ tư vấn đào tạo, lộ trình đào tạo
• Dịch vụ trả lời thắc mắc sinh viên
• Dịch vụ thay đổi nhu cầu học tập: thay đổi môn học, thay đổi lộ trình, chuyển tiếp đào tạo
• Sự thành công của sinh viên thông qua lộ trình phát triển nghề nghiệp
6. Các công việc khác theo từng dự án chương trình","Yêu cầu:
• Tốt nghiệp Thạc sỹ trở lên tại các nước phát triển. Ưu tiên tốt nghiệp Tiến sỹ hoặc tốt nghiệp Thạc sỹ trong lĩnh vực liên quan tới giáo dục từ các quốc gia Anh, Úc và Mỹ
• Tinh thần luôn sáng tạo và đổi mới
• Làm việc hướng khách hàng, hiểu khách hàng và luôn nghĩ tới giá trị cho khách hàng
• Khả năng giao tiếp và phối hợp xuất sắc
• Sự kiên trì và chú ý vào từng chi tiết của quá trình dịch vụ đào tạo
• Khả năng giao tiếp tốt và xử lý các vấn đề công việc
• Sử dụng tiếng Anh 100% trong các giao dịch với sinh viên, các hoạt động sự kiện của Trường
• Giữ kỷ luật công việc; đồng phục, tác phong, giờ giấc làm việc, các giá trị ethical của người đào tạo",09/08/2025,Giáo Dục > Quản Lý Giáo Dục,Giáo dục/Đào Tạo,2,Thạc Sĩ,Không hiển thị,1,08:00 - 17:30,Trưởng phòng,"Giao Tiếp Xuất Sắc, Hợp Tác Quốc Tế, Quản Lý Đào Tạo, Sáng Tạo, Tuyển dụng giáo viên",Bất kỳ,Không giới hạn,Bất kỳ,Bất kỳ,T2 - T7,Toàn thời gian,"Giáo Dục, Quản Lý Giáo Dục, Giáo dục/Đào Tạo, Giao Tiếp Xuất Sắc, Hợp Tác Quốc Tế, Quản Lý Đào Tạo, Sáng Tạo, Tuyển dụng giáo viên, Tổ chức Giáo dục FPT - FPT Education Đà Nẵng, Đà Nẵng"
"Bác Sĩ các chuyên khoa Nội, Nội Xương Khớp, Da Liễu (Internal Medicine Doctor, Rheumatologist, Dermatologist)",CÔNG TY CP BỆNH VIỆN ĐA KHOA SUN MEDICAL VIỆT NAM,20tr-40tr ₫/tháng,"Tầng 1, toà nhà Times Tower, 35 Lê Văn Lương, Thanh Xuân, Hà Nội","• Khám và chẩn đoán bệnh cho bệnh nhân.
• Lập kế hoạch điều trị và theo dõi sự tiến triển của bệnh.
• Tư vấn và hướng dẫn bệnh nhân về sức khỏe và dinh dưỡng.
• Thực hiện và đánh giá các xét nghiệm cần thiết.
• Phối hợp làm việc với các bác sĩ và chuyên gia khác trong bệnh viện.
• Tham gia các hoạt động đào tạo và phát triển chuyên môn.
• Đảm bảo tuân thủ các quy định và tiêu chuẩn y tế hiện hành.","• Có chứng chỉ hành nghề bác sĩ chuyên khoa hợp lệ.
• Ưu tiên đối với ứng viên có bằng chuyên khoa I, II, thạc sĩ.
• Có ít nhất 2 năm kinh nghiệm trong lĩnh vực chuyên môn.
• Ngoại hình tốt, tuổi dưới 40.
• Kỹ năng giao tiếp và tương tác tốt với bệnh nhân.
• Đam mê trong việc chăm sóc sức khỏe cộng đồng.
• Sẵn sàng tham gia các khóa đào tạo nâng cao.",09/08/2025,Y Tế/Chăm Sóc Sức Khoẻ > Bác Sĩ/Điều Trị Đa Khoa/Điều Trị Nội Trú,Dịch vụ Y tế/Chăm sóc sức khỏe,5,Cử nhân,Dưới 39 tuổi,8,9:00 - 17:30,Nhân viên,"Chăm Sóc Sức Khỏe, Chứng Chỉ Hành Nghề, Kiến thức chuyên môn, Tương Tác Tốt Với Bệnh Nhân",Bất kỳ,Người Việt Nam,Bất kỳ,Bất kỳ,T2 - T7,Toàn thời gian,"Y Tế/Chăm Sóc Sức Khoẻ, Bác Sĩ/Điều Trị Đa Khoa/Điều Trị Nội Trú, Dịch vụ Y tế/Chăm sóc sức khỏe, Chăm Sóc Sức Khỏe, Chứng Chỉ Hành Nghề, Kiến thức chuyên môn, Tương Tác Tốt Với Bệnh Nhân, CÔNG TY CP BỆNH VIỆN ĐA KHOA SUN MEDICAL VIỆT NAM, Hà Nội"
