Title,Company,Salary,Location,Job Description,Job Requirements,Date Posted,Industry,Field,Experience,Education,Age,Vacancy,Work Time,Level,Skills,Language,Nationality,Gender,Marital Status,Work Date,Work Type,Keyword
Nhân Viên Phòng Đảm Bảo Chất Lượng,Công Ty CP Dược – VTYT Thanh Hóa,Thương lượng,"04 Quang Trung, phường Hạc Thành, tỉnh Thanh Hoá, 04 Quang Trung, phường Ngọc Trạo, Tp Thanh Hoá","- Thiết lập, xây dựng quy trình và hệ thống quản lý chất lượng theo tiêu chuẩn GMP – WHO.
- Đảm bảo tuân thủ đúng các nguyên tắc nhằm đáp ứng yêu cầu về điều kiện sản xuất.
- Kiểm tra quy trình, thực hiện các bước so sánh với tiêu chuẩn đã được xác định từ trước.
- Thực hiện đánh giá hệ thống chất lượng hàng năm và đề xuất, điều chỉnh, thay đổi cho phù hợp hơn với sản phẩm.
- Phối hợp với khách hàng và nhà cung cấp để giải quyết các vấn đề liên quan đến chất lượng.
- Cùng các bên liên quan xem xét nguyên nhân và khắc phục hậu quả trong trường hợp xảy ra lỗi.
- Đưa ra tài liệu, biểu mẫu hướng dẫn, tiến hành huấn luyện những bộ phận liên quan áp dụng tiêu chuẩn, hệ thống chất lượng mới.
- Thực hiện các công việc khác theo sự phân công của lãnh đạo.",Mức độ phù hợp và xếp hạng của bạn so với ứng viên khác như thế nào?,13/01/2026,Sản Xuất > Đảm Bảo Chất Lượng/Kiểm Soát Chất Lượng/Quản Lý Chất Lượng,Dược phẩm,Không hiển thị,,,,,Nhân viên,"Đảm Bảo Chất Lượng, QA, Kiểm Soát Chất Lượng",Bất kỳ,Không hiển thị,,,,,"Sản Xuất, Đảm Bảo Chất Lượng/Kiểm Soát Chất Lượng/Quản Lý Chất Lượng, Dược phẩm, Đảm Bảo Chất Lượng, QA, Kiểm Soát Chất Lượng, Công Ty CP Dược – VTYT Thanh Hóa, Thanh Hóa"
[Urgent] Industrial Design Specialist (Consumer Electronics) - Hanoi,Navigos Search,"$ 1,000-1,200 /tháng","Hà Nội, Việt Nam, Hưng Yên, Hung Yen, Vietnam, Hanoi / HCMC","Navigos Search's client is one of the leading local brands in Consumer Electronics field.

- Research and apply new technologies in product design, manufacturing, and assembly processes.
- Collect information, analyze requirements, and creatively design product form and functionality to ensure aesthetics, usability, and safety, while optimizing manufacturability, cost efficiency, and market competitiveness.
- Collaborate with relevant departments to complete product development and participate in the production process of equipment and products.
- Create mockups and prototypes when required or upon request from management.
- Perform other assigned tasks as directed by supervisors.",Mức độ phù hợp và xếp hạng của bạn so với ứng viên khác như thế nào?,13/01/2026,Thiết Kế > Thiết Kế Công Nghiệp/Kỹ Thuật,Hàng tiêu dùng,3,Cử nhân,Không hiển thị,Không hiển thị,09:00 - 18:00,Nhân viên,"Design, Interior Design",Tiếng Anh,Không hiển thị,Không hiển thị,Không hiển thị,T2 - T7,Toàn thời gian,"Thiết Kế, Thiết Kế Công Nghiệp/Kỹ Thuật, Hàng tiêu dùng, Design, Interior Design, Navigos Search, Hà Nội, Hưng Yên"
HR Assistant Manager,"Deutsche Bekleidungswerke Co., Ltd",Thương lượng,"Lô P-1A, Đường số 6, khu công nghiệp Long Hậu (đối diện cổng KCN Hiệp Phước), Long Hậu, Huyện Cần Giuộc, Long An, Viet Nam, Plot P-1A, Street No 6, Long Hau Industrial Zone, Long Hau Commune, Can Giuoc Dist., Long An Provine, Viet Nam","We are looking for an experienced HR Assistant Manager with strong expertise in HR operations, compliance, and labor law, preferably from the garment or manufacturing industry.
Key Responsibilities
1. HR Operations & Employee Relations
• Support daily HR operations, including recruitment, onboarding, employee records, and HR reporting.
• Maintain strong employee relations; handle grievances, disciplinary actions, and conflict resolution professionally.
• Work closely with Production & Office leaders to ensure workforce planning and labor allocation align with operational needs.
2. Compliance & Legal
• Ensure full compliance with Vietnamese Labor Law, EPE regulations (if applicable), and company policies.
• Develop and update HR policies, SOPs, and employee handbook.
• Lead internal audits related to labor, payroll, attendance, and HR documentation.
• Coordinate with compliance teams (Social Compliance, C-TPAT, BSCI, WRAP, ISO, etc.) for audits and corrective action plans.
3. Recruitment & Talent Development
• Drive recruitment for key positions, especially production-office roles (IE, QA, Merchandising, Planning, etc.).",,13/01/2026,Nhân Sự/Tuyển Dụng > Nhân Sự Tổng Hợp,Dệt may/May mặc/Giày dép,5,,,,,Trưởng phòng,"MS Office, Compliance Control, Compliance Control, English proficiency, English proficiency, Manufacturing knowledge",Tiếng Anh,Không giới hạn,,,,,"Nhân Sự/Tuyển Dụng, Nhân Sự Tổng Hợp, Dệt may/May mặc/Giày dép, MS Office, Compliance Control, Compliance Control, English proficiency, English proficiency, Manufacturing knowledge, Deutsche Bekleidungswerke Co., Ltd, Hồ Chí Minh"
Key Account Manager (Beauty Chain - Sales Team),Meishang Cosmetics Vietnam (Colorkey BRAND),Thương lượng,"39/5 Đường Trần Nhật Duật, Tan Dinh, District 1, Ho Chi Minh City, Vietnam, Ho Chi Minh Office, Vietnam","• Create and execute strategic plans to grow key accounts (cosmetics/beauty chains, supermarket,...) and maximize profitability.
• Approach and acquire new key account customers, propose cooperation plan between COLORKEY and customers base on 2 side demands and win-win solution
• Closely take care of COLORKEY product display and merchandise at Key accounts’ stores, initiate discussions with KA and propose the merchandise plan to leverage the brand image and boost the sales at KA stores.
• Discuss with KA to propose and execute proper and effective activities to boost sale-out and sale-in (activation, promotion, etc.)
• Frequent go-to-market, proactively make out his/her own plan stores visit and report market situation to line MGR
• Manage KA sale-out price following the price policy by COLORKEY",Mức độ phù hợp và xếp hạng của bạn so với ứng viên khác như thế nào?,13/01/2026,Kinh Doanh > Bán Hàng/Phát Triển Kinh Doanh,Bán lẻ/Bán sỉ,Không yêu cầu,Không giới hạn,Không hiển thị,Không hiển thị,,Nhân viên,"Distributor System Management, Key Account Development, Cosmetic Marketing, Market Updates, Customer Experiences",Tiếng Anh,Không hiển thị,Không hiển thị,Không hiển thị,,Toàn thời gian,"Kinh Doanh, Bán Hàng/Phát Triển Kinh Doanh, Bán lẻ/Bán sỉ, Distributor System Management, Key Account Development, Cosmetic Marketing, Market Updates, Customer Experiences, Meishang Cosmetics Vietnam (Colorkey BRAND), Hồ Chí Minh"
Kế Toán Giá Thành (Lương 15-20M),CÔNG TY TNHH JCV CORP,15tr-20tr ₫/tháng,"Lô P-4, khu công nghiệp Tràng Duệ, phường An Hòa, quân An Dương,TP Hải Phòng, Lô P-4, khu công nghiệp Tràng Duệ, phường An Hòa, quân An Dương,TP Hải Phòng","• Thu thập và ghi chép sổ sách đầy đủ các chi phí nguyên vật liệu và chi phí sản xuất chung.
• Đảm bảo phân bổ hợp lý các chi phí chung cho từng loại sản phẩm.
• Tính toán giá thành thực tế cho từng sản phẩm và quy trình sản xuất (hệ thống tính toán).
• Theo dõi và kiểm soát giá trị tồn kho của nguyên vật liệu, thành phẩm và bán thành phẩm.
• Đối chiếu định kỳ dữ liệu tồn kho giữa sổ sách kế toán và sổ kho.
• Lập các báo cáo giá thành định kỳ theo yêu cầu của ban quản lý.
• Cung cấp phân tích chi phí để hỗ trợ các quyết định về giá bán, chi phí và kế hoạch sản xuất.
• Kiểm tra tính hợp lý của chi phí, đảm bảo hóa đơn và chứng từ hợp lệ.
• Định kỳ đối chiếu và điều chỉnh các dữ liệu sai sót, đảm bảo tính chính xác của hệ thống kế toán.
• Phối hợp chặt chẽ với các bộ phận liên quan để thu thập dữ liệu và thực hiện điều chỉnh kịp thời.",Mức độ phù hợp và xếp hạng của bạn so với ứng viên khác như thế nào?,13/01/2026,Kế Toán/Kiểm Toán > Kế Toán Tài Chính,Thời trang/Trang sức,1,,,,,Nhân viên,"ERP, Kế toán, Kế Toán Giá Thành, SAP, Tài Chính",Bất kỳ,Không hiển thị,,,,,"Kế Toán/Kiểm Toán, Kế Toán Tài Chính, Thời trang/Trang sức, ERP, Kế toán, Kế Toán Giá Thành, SAP, Tài Chính, CÔNG TY TNHH JCV CORP, Hải Phòng"
Kỹ Sư Cơ Điện Tại Công Trường (Lương 22-28 Triệu),"MDA E&C Co.,ltd",22tr-28tr ₫/tháng,"Cụm Công nghiệp Đồng Sóc, xã Vũ Di, tỉnh Phú Thọ, Tòa nhà Licogi 13 Tower, 164 Khuất Duy Tiến, Phường Thanh Xuân, TP Hà Nội, 7th floor, Licogi 13 Tower, No. 164 Khuat Duy Tien Street, Thanh Xuan, Ha Noi","- Giám sát thi công, điều phối đảm bảo tiến độ hạng mục cơ/điện cho dự án xây dựng nhà máy, nhà xưởng, khu công nghiệp
- Hoàn công bản vẽ và khối lượng quyết toán, thay đổi phát sinh với Chủ đầu tư và nhà thầu phụ.
- Phối hợp với đội thiết kế cơ điện tại văn phòng để lập và kiểm soát tiến độ, chất lượng thi công của nhà thầu theo bản vẽ và khối lượng hợp đồng.

Địa điểm làm việc:
- Nhà máy Interflex, Cụm Công nghiệp Đồng Sóc, xã Vũ Di, tỉnh Phú Thọ",Mức độ phù hợp và xếp hạng của bạn so với ứng viên khác như thế nào?,13/01/2026,Kiến Trúc/Xây Dựng > Xây Dựng,Kỹ thuật xây dựng/Cơ sở hạ tầng,1,Cử nhân,Không hiển thị,Không hiển thị,,Nhân viên,"AutoCAD, Cơ Điện, Revit, Thiết kế bản vẽ cơ điện, Giám Sát Thi Công",Bất kỳ,Không hiển thị,Không hiển thị,Không hiển thị,,Toàn thời gian,"Kiến Trúc/Xây Dựng, Xây Dựng, Kỹ thuật xây dựng/Cơ sở hạ tầng, AutoCAD, Cơ Điện, Revit, Thiết kế bản vẽ cơ điện, Giám Sát Thi Công, MDA E&C Co.,ltd, Phú Thọ, Hà Nội"
Kỹ Sư Giám Sát và Quản Lý Vận Hành Trạm Xử Lý Nước Thải (Lương 25-30 Triệu),"MDA E&C Co.,ltd",25tr-30tr ₫/tháng,"Cụm công nghiệp Giang Biên, Hải Phòng, 7th floor, Licogi 13 Tower, No. 164 Khuat Duy Tien Street, Nhan Chinh, Thanh Xuan, Ha Noi","- Kiểm tra vận hành xử lý nước thải, ghi chép thông tin liên quan đến nhật kí vận hành
- Pha hóa chất, nuôi cấy vi sinh cho việc xử lý nước
- Giám sát chỉ tiêu của từng bể hệ thống xử lý nước thải
- Rà soát hồ sơ thiết kế và giám sát quá trình thi công nước thải.
- Theo dõi, kiểm tra, xử lý kỹ thuật đảm bảo nước đạt chất lượng yêu cầu.
- Theo dõi từng chỉ tiêu nước thải đầu ra của hệ thống, để kịp thời xử lý khi có sự cố xảy ra.
- Và một số công việc khác theo sự phân công của quản lý cấp trên.

Địa chỉ làm việc:
MDA Giang Biên IP - Cụm công nghiệp Giang Biên, Hải Phòng",Mức độ phù hợp và xếp hạng của bạn so với ứng viên khác như thế nào?,13/01/2026,Kiến Trúc/Xây Dựng > Thiết Kế Kiến Trúc/Họa Viên Kiến Trúc,Kỹ thuật xây dựng/Cơ sở hạ tầng,2,,,,,Nhân viên,"Cấp Thoát Nước, Quản Lý Vận Hành, Xử Lý Nước Thải, Công Nghệ Hóa Học, Kỹ Thuật Điện",Bất kỳ,Không hiển thị,,,,,"Kiến Trúc/Xây Dựng, Thiết Kế Kiến Trúc/Họa Viên Kiến Trúc, Kỹ thuật xây dựng/Cơ sở hạ tầng, Cấp Thoát Nước, Quản Lý Vận Hành, Xử Lý Nước Thải, Công Nghệ Hóa Học, Kỹ Thuật Điện, MDA E&C Co.,ltd, Hải Phòng"
QC Director (Dự Án Xây Dựng Sân Bay),Công Ty Cổ Phần Tập Đoàn Masterise,Thương lượng,"Gia Bình, Bắc Ninh, Việt Nam, 458 Minh Khai, Vĩnh Tuy, Hà Nội, Lumiere West Tower, Thảo Điền, TP. Thủ Đức, TP. Hồ Chí Minh","Chịu trách nhiệm cao nhất về quản lý và kiểm soát chất lượng (QA/QC) cho toàn bộ dự án xây dựng sân bay, đảm bảo công trình đáp ứng yêu cầu thiết kế, tiêu chuẩn kỹ thuật, quy chuẩn pháp luật và yêu cầu của Chủ đầu tư/Cơ quan Hàng không.
Xây dựng, ban hành và tổ chức triển khai QA/QC Plan, hệ thống quy trình, biểu mẫu, ITP, Method Statement liên quan đến công tác kiểm soát chất lượng cho tất cả các hạng mục dự án.
Thiết lập và kiểm soát tiêu chuẩn chất lượng cho các hạng mục chính: hạ tầng, đường băng – sân đỗ, nhà ga, kết cấu, hoàn thiện, MEP và các hệ thống kỹ thuật hàng không.
Kiểm soát việc tuân thủ chất lượng của các nhà thầu, thầu phụ và nhà cung cấp, bao gồm: vật liệu đầu vào, biện pháp thi công, công tác nghiệm thu và hồ sơ chất lượng.
Đánh giá, phê duyệt các đề xuất kỹ thuật, biện pháp thi công liên quan đến chất lượng; phối hợp với Ban điều hành dự án trong việc kiểm soát rủi ro chất lượng.

Quản lý, điều hành và phát triển đội ngũ QA/QC Engineers, Inspectors tại công trường; tổ chức đào tạo, hướng dẫn và đánh giá năng lực nhân sự QC.
Là đầu mối làm việc với Chủ đầu tư, Tư vấn giám sát, Cục Hàng không và các cơ quan quản lý trong công tác kiểm tra, nghiệm thu, đánh giá chất lượng.
Tổ chức xử lý các vấn đề không phù hợp (NCR), xác định nguyên nhân gốc rễ và theo dõi việc khắc phục, phòng ngừa.
Lập báo cáo định kỳ/đột xuất về tình hình chất lượng, rủi ro và đề xuất giải pháp cải tiến.
Tham gia nghiệm thu hoàn thành, bàn giao công trình, hoàn thiện hồ sơ hoàn công và hỗ trợ giai đoạn vận hành ban đầu (nếu có).",Mức độ phù hợp và xếp hạng của bạn so với ứng viên khác như thế nào?,13/01/2026,Kiến Trúc/Xây Dựng > Xây Dựng,Kỹ thuật xây dựng/Cơ sở hạ tầng,Không hiển thị,Không giới hạn,Không hiển thị,Không hiển thị,,Giám Đốc và Cấp Cao Hơn,"Kiểm Soát Chất Lượng Thi Công, Kiếm Soát Kỹ Thuật, Tiếng Anh, Chất Lượng Xây Dựng, Quản lý chất lượng",Bất kỳ,Không hiển thị,Không hiển thị,Không hiển thị,,Toàn thời gian,"Kiến Trúc/Xây Dựng, Xây Dựng, Kỹ thuật xây dựng/Cơ sở hạ tầng, Kiểm Soát Chất Lượng Thi Công, Kiếm Soát Kỹ Thuật, Tiếng Anh, Chất Lượng Xây Dựng, Quản lý chất lượng, Công Ty Cổ Phần Tập Đoàn Masterise, Bắc Ninh, Hà Nội"
"EHS Senior Officer/ Nhân Viên Cấp Cao Môi Trường- Sức Khỏe- An Toàn- Work in Nui Thanh, Da Nang (Huyện Núi Thành, Tỉnh Quảng Nam Cũ)",Công Ty TNHH CCI Việt Nam,Thương lượng,"Khu công nghiệp Bắc Chu Lai, xã Núi Thành, thành phố Đà Nẵng, Việt Nam, Bac Chu Lai Industrial Park, Nui Thanh commune, Da Nang city, Vietnam","• Ensure all work are safe & compliance with OSH, ISO1400, CSR (including but not limited to RBA standard regulations).
• Review, develop, implement and improve the company EHS procedures to ensure compliance with statutory regulations and other requirements.
• Ensure all Environment, Health, and Safety policies, procedures, rules, and regulation are adhered to and are regular reviewed, updated & communicated.
• Ensure compliance to EHS (Environment, Health, and Safety) standard and initiatives within department.
• Ensure all accidents are documented, investigated, and propose / recommend for improvement.
• Ensure security procedure & standard are follow such as emergency – fire alarms, injuries, chemical spillage.
• Ensure safety inspection are carried out fire drills, fire alarms are correctly reported. Oversee the company’s fire alarm system, emergency and rescue equipment.
• Safety inspection, risk assessment and working procedure are managed and employees are aware their responsibilities – Behavior Based Safety (BBS). Implement safety campaigns and practises to promote and inculcate safety culture within the company.
• Established a full program documented Environment, Health & Safety Inspection, Customers and CSR audits, and established structural program Safety Training throughout the company.
• Maintain, update and retain relevant records, documentations and certifications as required under the regulatory authorities and other requirements.",,13/01/2026,Kiến Trúc/Xây Dựng > An Toàn Lao Động,Điện/Điện tử,10,,,,,Nhân viên,"EHS Compliance, Data Analysis, English Communication, Safety Training, Independent work",Tiếng Anh,Không hiển thị,,,,,"Kiến Trúc/Xây Dựng, An Toàn Lao Động, Điện/Điện tử, EHS Compliance, Data Analysis, English Communication, Safety Training, Independent work, Công Ty TNHH CCI Việt Nam, Đà Nẵng"
Phó Phòng Thẩm Định Giá,Công Ty Cổ Phần Thaiholdings,Thương lượng,"210 Đường Trần Quang Khải, Hoàn Kiếm, Hanoi, Vietnam, 210 Trần Quang Khải, Hoàn Kiếm, Hà Nội","- Hỗ trợ cho Phó TGĐ chuyên trách trong quản lý và điều hành công việc; thực hiện nhiệm vụ, quyền hạn theo sự phân công của Tổng Giám đốc Công ty/Phó Tổng Giám đốc chuyên trách và chịu trách nhiệm trước Ban Tổng Giám đốc, Hội đồng quản trị về kết quả thực hiện nhiệm vụ được giao.
- Quản lý, triển khai việc thẩm định giá tài sản và tư vấn thông tin giá;
- Quản lý, điều phối hoạt động, các nội dung công việc của Phòng Thẩm định giá;
- Đầu mối làm việc với các bộ phận, cơ quan ban ngành liên quan đến lĩnh vực hoạt động của công ty.
- Báo cáo trực tiếp cho Tổng Giám đốc/ Phó TGĐ chuyên trách.",Mức độ phù hợp và xếp hạng của bạn so với ứng viên khác như thế nào?,13/01/2026,Bất Động Sản > Định Giá,Bất Động Sản/Cho thuê,3,Cử nhân,Không hiển thị,Không hiển thị,,Trưởng phòng,"Thẩm Định Giá, Định Giá, Thẩm Định Giá Tài Sản, Tài Chính Ngân Hàng, Quản trị Kinh doanh",Bất kỳ,Không hiển thị,Không hiển thị,Không hiển thị,,Toàn thời gian,"Bất Động Sản, Định Giá, Bất Động Sản/Cho thuê, Thẩm Định Giá, Định Giá, Thẩm Định Giá Tài Sản, Tài Chính Ngân Hàng, Quản trị Kinh doanh, Công Ty Cổ Phần Thaiholdings, Hà Nội"
Nhân Viên Dịch Vụ Hàng Không,Công Ty Cổ Phần Dịch Vụ Suất Ăn Hàng Không Việt Nam,Thương lượng,"Cảng hàng không quốc tế Long Thành, tỉnh Đồng Nai, Cảng Hàng không Quốc tế Nội Bài, xã Phú Minh, huyện Sóc Sơn, Hà Nội","Công Ty TNHH Suất Ăn Hàng Không Vinacs Long Thành là đơn vị thành viên của Công ty Cổ phần Dịch vụ Suất ăn Hàng không Việt Nam (VINACS), hoạt động trong lĩnh vực cung cấp dịch vụ suất ăn hàng không.
Nhằm chuẩn bị cho việc vận hành và khai thác tại Cảng hàng không quốc tế Long Thành, hiện nay VINACS Long Thành có nhu cầu tuyển dụng lao động cho các vị trí làm việc tại Long Thành, tỉnh Đồng Nai, với thông tin cụ thể như sau:

Mô tả công việc:
- Tập hợp suất ăn, vật phẩm từ các bộ phận trong Công ty; Chất xếp lên xe ô tô chuyên dụng và giao cho khách hàng tại máy bay theo đúng yêu cầu đã được triển khai.",Mức độ phù hợp và xếp hạng của bạn so với ứng viên khác như thế nào?,13/01/2026,Vận Tải > Dịch Vụ Hàng Không,Dịch vụ lưu trú/Nhà hàng/Khách sạn/Du lịch,Không hiển thị,,,,,Nhân viên,"Hàng Không, Giao Nhận Vận Chuyển, Dịch Vụ Khách Hàng, Tiếng Anh",Bất kỳ,Không hiển thị,,,,,"Vận Tải, Dịch Vụ Hàng Không, Dịch vụ lưu trú/Nhà hàng/Khách sạn/Du lịch, Hàng Không, Giao Nhận Vận Chuyển, Dịch Vụ Khách Hàng, Tiếng Anh, Công Ty Cổ Phần Dịch Vụ Suất Ăn Hàng Không Việt Nam, Đồng Nai"
Sales Executive B2B,FUJIFILM Business Innovation Vietnam,Thương lượng,"19th Floor, The Hallmark Building, 15 Tran Bach Dang st, Thu Thiem Ward, Thu Duc City, Ho Chi Minh, 14 Floor, VCCI Tower, 9 Đào Duy Anh, Phường Kim Liên, Hà nội, 19th Floor, The Hallmark Building, 15 Tran Bach Dang, Thu Thiem Ward, Thu Duc City, Ho Chi Minh.","An overview, A talent for sales position at FUJIFILM Business Innovation Vietnam is a dynamic person who are to be a hunter, passionate in bringing the best solution to customers, work very hard for the result and get rewards for high performances.
- Selling FUJIFILM Business Innovation products and services direct to customers Ho Chi Minh city/or Hanoi city & provinces nearby
80% working time will be on field to visit listed customers directly to allocated territories and discover the potential needs of customers
- Delivering sustainable business performance and achieving sales target to contribute the growth of FUJIFILM Business Innovation Vietnam
- Making presentations to customer and introducing FUJIFILM Business Innovation’s Innovative and high-quality Printing Solution, Software Solutions, IT Devices…
- Developing consultative sales skills; learning about Customers procurement functions, staying current with all aspects of business including industry and competitive data; learning and keeping others informed of competitive market information
- Submitting weekly, monthly sales report to direct manager as required
- Possessing market intelligence on including related projects & opportunities, competition and competitor activities/trends, contingency plans for changing market conditions",,13/01/2026,Kinh Doanh > Bán Hàng/Phát Triển Kinh Doanh,Hệ thống CNTT & Thiết bị,1,,,,,Nhân viên,"Kinh Doanh, Business Development, B2B Sales, Bán Hàng, Customer Service",Tiếng Anh,Không hiển thị,,,,,"Kinh Doanh, Bán Hàng/Phát Triển Kinh Doanh, Hệ thống CNTT & Thiết bị, Kinh Doanh, Business Development, B2B Sales, Bán Hàng, Customer Service, FUJIFILM Business Innovation Vietnam, Hồ Chí Minh, Hà Nội"
Category Specialist (Chuyên viên ngành hàng),Social Bella Vietnam,Thương lượng,"5th Floor, 53-55-57 Pho Duc Chinh, Nguyen Thai Binh Ward, District 1, HCMC, 5th Floor, TSA Building, 53-55-57 Pho Duc Chinh, Nguyen Thai Binh Ward, District 1,HCMC","1. Manage assigned brand portfolios and their performances
2. Ensuring the brand achieve sales target for monthly, quarterly and annually
3. Involve in campaigns and create individual campaigns for brand partners
4. Engage with the brands to join the campaign (exclusivity, traffic, always on promotion)
5. Adjust stock availability and slow moving or dead stocks/returned stocks etc...
6. Negotiate and deal with brands for the best support for Sociolla under the guidance of line manager
7. Manage all other administrative tasks to make sure brands are listed and activated successfully on Sociolla online store",Mức độ phù hợp và xếp hạng của bạn so với ứng viên khác như thế nào?,13/01/2026,Kinh Doanh > Bán Hàng/Phát Triển Kinh Doanh,Làm đẹp (Mỹ phẩm) & Chăm sóc cá nhân,3,,,,,Nhân viên,"Brand Management, Campaign Management, Communication Skills, Negotiation Skills, Sales Target",Bất kỳ,Người Việt Nam,,,,,"Kinh Doanh, Bán Hàng/Phát Triển Kinh Doanh, Làm đẹp (Mỹ phẩm) & Chăm sóc cá nhân, Brand Management, Campaign Management, Communication Skills, Negotiation Skills, Sales Target, Social Bella Vietnam, Hồ Chí Minh"
