Title,Company,Salary,Location,Job Description,Job Requirements,Date Posted,Industry,Field,Experience,Education,Age,Vacancy,Work Time,Level,Skills,Language,Nationality,Gender,Marital Status,Work Date,Work Type,Keyword
Chuyên Viên Kỹ Thuật Dữ Liệu (Data Engineer),Trường Đại Học Kinh Tế - Tài Chính TPHCM,Thương lượng,"Hồ Chí Minh, Việt Nam, 141-145 Điện Biên Phủ, Phường 15, Quận Bình Thạnh, TP.HCM","- Xây dựng và duy trì các pipeline dữ liệu (ETL – Extract, Transform, Load) để thu thập, xử lý và lưu trữ dữ liệu học tập, hành chính từ các nguồn khác nhau của trường (như hệ thống LMS, cơ sở dữ liệu sinh viên).
- Tích hợp dữ liệu từ các hệ thống hiện có, đảm bảo dữ liệu sạch, đáng tin cậy và sẵn sàng cho phân tích hoặc ứng dụng AI.
- Hỗ trợ phát triển cơ sở hạ tầng dữ liệu, bao gồm việc sử dụng các công cụ lưu trữ đám mây (như AWS S3, Google BigQuery) để tối ưu hóa hiệu suất và chi phí.
- Hợp tác với các nhóm phát triển và AI để cung cấp dữ liệu chất lượng cao cho các mô hình học máy và phân tích.
- Giám sát và khắc phục sự cố liên quan đến dữ liệu, đảm bảo tính bảo mật và tuân thủ các quy định về dữ liệu cá nhân (như GDPR hoặc quy định địa phương).
- Tham gia nghiên cứu và triển khai các công nghệ dữ liệu mới phù hợp với môi trường giáo dục.",Mức độ phù hợp và xếp hạng của bạn so với ứng viên khác như thế nào?,13/01/2026,Công Nghệ Thông Tin/Viễn Thông > Data Engineer/Data Analyst/AI,Giáo dục/Đào Tạo,1,,,,,Nhân viên,"Python, Apache Spark, SQL, Big Data, Java",Bất kỳ,Không hiển thị,,,,,"Công Nghệ Thông Tin/Viễn Thông, Data Engineer/Data Analyst/AI, Giáo dục/Đào Tạo, Python, Apache Spark, SQL, Big Data, Java, Trường Đại Học Kinh Tế - Tài Chính TPHCM, Hồ Chí Minh"
Nhân Viên Mua Hàng,Công Ty Cổ Phần Kỹ Thuật Temas,$ 520-600 /tháng,"Số 60, Đường 291, Phường Long Trường, TP.Hồ Chí Minh (Verosa Park), VP.Hà Nội: TT2A-6, Khu ĐG1, Phường Xuân Phương, TP. Hà Nội; VP.HCM: Số 02, Lô C2, Đường 50, KDC Phú Nhuận, Phường Phước Long, TP. HCM","- Tiếp nhận các yêu cầu mua từ phòng kinh doanh kỹ thuật; liên hệ với nhà cung cấp để lấy báo giá sản phẩm; thương lượng, đàm phán để tối ưu về giá cả, tiến độ, chất lượng.
- Theo dõi tiến độ hàng về. Xử lý các vấn đề phát sinh trong quá trình giao nhận hàng (lỗi, hư hỏng, trễ…).
- Nhận hàng, kiểm hàng, nhập kho.
- Hoàn thiện hồ sơ chứng từ thanh toán cho nhà cung cấp.
- Đánh giá nhà cung cấp định kỳ.
- Tìm kiếm các nhà cung cấp mới.
- Tiếp nhận và mua các hàng hóa, dịch vụ liên quan tới văn phòng.
- Một số công việc hành chính văn phòng khác",Mức độ phù hợp và xếp hạng của bạn so với ứng viên khác như thế nào?,13/01/2026,Hậu Cần/Xuất Nhập Khẩu/Kho Bãi > Thu Mua & Quản Trị Hàng Tồn Kho,Cơ khí/Máy móc/Thiết bị công nghiệp,1,Cử nhân,Không hiển thị,Không hiển thị,,Nhân viên,"Mua Hàng, Thu Mua, Mua Hàng Nước Ngoài, Xuất Nhập Khẩu, Mua Hàng Kỹ Thuật",Bất kỳ,Không hiển thị,Không hiển thị,Không hiển thị,,Toàn thời gian,"Hậu Cần/Xuất Nhập Khẩu/Kho Bãi, Thu Mua & Quản Trị Hàng Tồn Kho, Cơ khí/Máy móc/Thiết bị công nghiệp, Mua Hàng, Thu Mua, Mua Hàng Nước Ngoài, Xuất Nhập Khẩu, Mua Hàng Kỹ Thuật, Công Ty Cổ Phần Kỹ Thuật Temas, Hồ Chí Minh"
Trưởng phòng Báo cáo và kiểm soát tài chính,Công Ty CP Xuất Nhập Khẩu Bến Tre,Thương lượng,"63 Cao Thắng Phường, Phường 3, District 3, Thành phố Hồ Chí Minh, Vietnam, Số 75 Đường 30/4, Phường 3, Tp. Bến Tre","Cấp độ vận hành
• Xây dựng và quản lý hệ thống kế toán để đảm bảo công việc kế toán của Công ty tuân thủ các chuẩn mực kế toán (IFRS và VAS), pháp luật nhà nước và đáp ứng việc phát hành/thuyết minh/trình bày các báo cáo Tài chính & Hợp nhất/Riêng một cách chính xác, kịp thời và đầy đủ.
• Nắm rõ cơ cấu tổ chức Công ty (quy trình, chức năng, vị trí, pháp nhân) và yêu cầu quản lý để xây dựng hệ thống kế toán phù hợp.
• Phối hợp với các phòng ban để đảm bảo tài sản, hàng tồn kho được đo lường, ghi nhận đầy đủ và kịp thời.
• Đảm bảo các báo cáo thuế và việc nộp thuế được đầy đủ, kịp thời và hiệu quả.
• Đề xuất các giải pháp tổ chức tối ưu hóa thuế.
• Tham gia vào việc chuẩn bị ngân sách doanh thu và CAPEX hàng năm, giám sát hiệu quả tài chính.
• Lập các báo cáo tài chính và các báo cáo nội bộ hàng tháng/quý/năm phù hợp với thời hạn yêu cầu từ Giám đốc Tài chính và các tổ chức quản lý bên ngoài khác.
• Cải thiện và quản lý các thủ tục kế toán và vận hành bằng các biện pháp và biện pháp kiểm soát nội bộ phù hợp.
• Hỗ trợ Giám đốc Tài chính trong việc báo cáo và trình bày trước Hội đồng quản trị về Hiệu quả Hoạt động.
• Soát xét và phê duyệt toàn bộ các hồ sơ liên quan đến chi phí của Công ty.
• Tham mưu cho Ban Giám đốc cũng như các phòng ban liên quan để đảm bảo tối ưu hóa vận hành và tối thiểu rủi ro liên quan đến Kế toán, Thuế.",,13/01/2026,Kế Toán/Kiểm Toán > Kế Toán Tài Chính,Hàng tiêu dùng,5,,,,,Trưởng phòng,"Accounting knowledge, Financial Statement Analysis, Leadership Skills, Systemic Thinking, Training Development",Bất kỳ,Không giới hạn,,,,,"Kế Toán/Kiểm Toán, Kế Toán Tài Chính, Hàng tiêu dùng, Accounting knowledge, Financial Statement Analysis, Leadership Skills, Systemic Thinking, Training Development, Công Ty CP Xuất Nhập Khẩu Bến Tre, Hồ Chí Minh"
Trưởng Nhóm Lập Trình,Trường Đại Học Kinh Tế - Tài Chính TPHCM,Thương lượng,"Hồ Chí Minh, Việt Nam, 141-145 Điện Biên Phủ, Phường 15, Quận Bình Thạnh, TP.HCM","Hình thức làm việc: Toàn thời gian

Mô tả công việc
- Lãnh đạo và quản lý nhóm lập trình (5-10 thành viên), phân công nhiệm vụ, giám sát tiến độ và đảm bảo chất lượng sản phẩm.
- Thiết kế, phát triển và tối ưu hóa các ứng dụng sử dụng .NET Core (API) theo kiến trúc Microservices.
- Xây dựng và duy trì hệ thống cơ sở dữ liệu sử dụng SQL Server, PostgreSQL, MongoDB, và hệ thống cache như Redis.
- Triển khai và quản lý ứng dụng sử dụng Docker để đảm bảo tính nhất quán và khả năng triển khai linh hoạt.
- Thiết lập và duy trì quy trình CI/CD sử dụng GitHub hoặc GitLab để tự động hóa quá trình phát triển và triển khai.
- Đảm bảo codebase sạch, dễ bảo trì và tuân thủ các tiêu chuẩn lập trình.
- Đề xuất và triển khai các giải pháp công nghệ mới để cải thiện hiệu suất và chất lượng sản phẩm.
- Hỗ trợ đào tạo, mentoring các thành viên trong nhóm để nâng cao kỹ năng chuyên môn.
- Tham gia tuyển dụng, đánh giá và phát triển đội ngũ lập trình viên.
- Phối hợp với các bên liên quan để đảm bảo dự án đạt được mục tiêu.",Mức độ phù hợp và xếp hạng của bạn so với ứng viên khác như thế nào?,13/01/2026,Công Nghệ Thông Tin/Viễn Thông > Phần Mềm Máy Tính,Giáo dục/Đào Tạo,5,Cử nhân,Không hiển thị,Không hiển thị,07:30 - 16:30,Nhân viên,"ReactJs, .Net, Microservices, PostgreSQL, API",Bất kỳ,Không hiển thị,Không hiển thị,Không hiển thị,T2 - T6,Toàn thời gian,"Công Nghệ Thông Tin/Viễn Thông, Phần Mềm Máy Tính, Giáo dục/Đào Tạo, ReactJs, .Net, Microservices, PostgreSQL, API, Trường Đại Học Kinh Tế - Tài Chính TPHCM, Hồ Chí Minh"
Business Accountant,Công Ty TNHH Finassist,Thương lượng,"Hello World Saigon, Đường Nguyễn Hữu Cảnh, Saigon Pearl, Phường 22, Bình Thạnh, Ho Chi Minh City, Vietnam, Hello World Saigon, 92A Nguyễn Hữu Cảnh, phường 22, quận Bình Thạnh","About Us: At FinAssist, we are a fast-growing professional services firm specialising in outsourced Financial Planning and Accounting support for Australian advisers and business clients. Our work spans major cities including Sydney, Melbourne, Adelaide and Brisbane, offering an engaging and collaborative environment for our Vietnam team. More information can be found on our parent company’s website: https://www.aptiumassist.com.au/about
We are now seeking an experienced Business Accountant to join our team, providing high-quality tax and accounting support for Australian individuals, SMEs, partnerships, companies and trusts — all delivered remotely from our Ho Chi Minh Office.

Key Responsibilities
1. Tax Compliance & Lodgements
- Prepare Income Tax Returns for:
• Individuals
• Partnerships
• Companies
• Trusts
• Other commercial structures (as required)
- Prepare supporting schedules, workpapers, and reconciliations in alignment with Australian Taxation Office (ATO) requirements.",,13/01/2026,Ngân Hàng & Dịch Vụ Tài Chính > Phân Tích & Báo Cáo Tài Chính,Tài Chính,3,,,,,Nhân viên,"English, Economics, Finance, Accounting, Business Accounting",Tiếng Anh,Không hiển thị,,,,,"Ngân Hàng & Dịch Vụ Tài Chính, Phân Tích & Báo Cáo Tài Chính, Tài Chính, English, Economics, Finance, Accounting, Business Accounting, Công Ty TNHH Finassist, Hồ Chí Minh"
Chuyên Viên Kỹ Thuật Trí Tuệ Nhân Tạo (AI Engineer),Trường Đại Học Kinh Tế - Tài Chính TPHCM,Thương lượng,"Hồ Chí Minh, Việt Nam, 141-145 Điện Biên Phủ, Phường 15, Quận Bình Thạnh, TP.HCM","- Phát triển và triển khai các mô hình AI/ML để hỗ trợ các ứng dụng giáo dục, như hệ thống khuyến nghị khóa học, phân tích hành vi học tập của sinh viên, hoặc công cụ tự động hóa hành chính.
- Tích hợp các giải pháp AI vào hệ thống hiện có của trường (như LMS hoặc chatbot hỗ trợ), đảm bảo tính tương thích và hiệu suất cao.
- Hỗ trợ lãnh đạo CNTT trong việc nghiên cứu, thử nghiệm và tối ưu hóa các mô hình AI, bao gồm việc sử dụng dữ liệu học tập để cải thiện chất lượng giáo dục.
- Xử lý dữ liệu đầu vào cho mô hình AI, bao gồm tiền xử lý, huấn luyện và đánh giá mô hình.
- Thực hiện các buổi hướng dẫn cơ bản về AI cho đội ngũ nhân viên và sinh viên, giúp họ áp dụng công cụ AI trong công việc hàng ngày.
- Giám sát và cập nhật các ứng dụng AI để đảm bảo tính chính xác, bảo mật và tuân thủ đạo đức AI.",Mức độ phù hợp và xếp hạng của bạn so với ứng viên khác như thế nào?,13/01/2026,Công Nghệ Thông Tin/Viễn Thông > Data Engineer/Data Analyst/AI,Giáo dục/Đào Tạo,1,Cử nhân,Không hiển thị,Không hiển thị,,Nhân viên,"AI Engineering, AI/ML, Lập Trình Python, Deep Learning, TensorFlow",Bất kỳ,Không hiển thị,Không hiển thị,Không hiển thị,,Toàn thời gian,"Công Nghệ Thông Tin/Viễn Thông, Data Engineer/Data Analyst/AI, Giáo dục/Đào Tạo, AI Engineering, AI/ML, Lập Trình Python, Deep Learning, TensorFlow, Trường Đại Học Kinh Tế - Tài Chính TPHCM, Hồ Chí Minh"
"Chuyên Viên Quản Trị Danh Mục, Định Vị & Trải Nghiệm KHCN - Khối Khách Hàng Cá Nhân",Ngân hàng TMCP Đông Nam Á (SeABank),Thương lượng,"Hội sở SeABank – 198 Trần Quang Khải, Phường Hoàn Kiếm, Hà Nội, BRG Tower, 198 Trần Quang Khải, Phường Hoàn Kiếm, Hà Nội","Mô tả công việc
• Chịu trách nhiệm đối với các mục tiêu phát triển về quy mô, hiệu quả của phân khúc khách hàng đại chúng (chưa đủ điều kiện là KHUT) theo định hướng của Khối Khách hàng cá nhân và Ngân hàng.
• Thực hiện các hoạt động nghiên cứu thị trường, địa bàn, đối thủ cạnh tranh, phân tích danh mục trên phân khúc khách hàng đại chúng nhằm phân khúc và lựa chọn các tiểu phân khúc, nhóm khách hàng mục tiêu.
• Quản lý, cập nhật các thông tin khách hàng (nhân khẩu học, quan điểm, nhu cầu/ hành vi,…) và hiểu hành vi nhu cầu của tập khách hàng để xây dựng Định vị giá trị tiêu chuẩn (sản phẩm, giá, dịch vụ, độ thuận tiện, trải nghiệm), đồng thời phát hiện các cơ hội khai thác trên danh mục khách hàng hiện hữu.
• Xây dựng bộ chính sách tiêu chuẩn dành cho khách hàng và mô hình bán hàng và dịch vụ cho các phân khúc, tiểu phân khúc và cho từng nhóm khách hàng mục tiêu.
• Xây dựng chính sách theo năng lực cho đội ngũ bán phân khúc khách hàng đại chúng: Tiêu chuẩn năng lực, lộ trình phát triển, chương trình đào tạo/ nâng cao năng lực.
• Phối hợp với các Giải pháp & Phát triển và các Đơn vị, bộ phận liên quan đóng gói các sản phẩm hoặc cải tiến, phát triển các sản phẩm phù hợp với từng tiểu phân khúc, tập khách hàng của phân khúc khách hàng đại chúng theo định hướng chiến lược từng thời kỳ của Khối và Ngân hàng.
• Nghiên cứu, xây dựng, triển khai và quản lý hiệu quả các chương trình dành cho phân khúc khách hàng đại chúng: hỗ trợ sau bán, khuyến mại, chăm sóc, giữ chân khách hàng, bán thêm bán chéo trên khách hàng hiện hữu,...",,13/01/2026,Ngân Hàng & Dịch Vụ Tài Chính > Dịch Vụ Hỗ Trợ Khách Hàng,Tài Chính,2,,,,,Nhân viên,"Giao Tiếp Và Tạo Ảnh Hưởng, Lập Kế Hoạch, Phân Tích Chiến Lược, Quản Lý Trải Nghiệm Khách Hàng, Xây Dựng Mối Quan Hệ",Bất kỳ,Không giới hạn,,,,,"Ngân Hàng & Dịch Vụ Tài Chính, Dịch Vụ Hỗ Trợ Khách Hàng, Tài Chính, Giao Tiếp Và Tạo Ảnh Hưởng, Lập Kế Hoạch, Phân Tích Chiến Lược, Quản Lý Trải Nghiệm Khách Hàng, Xây Dựng Mối Quan Hệ, Ngân hàng TMCP Đông Nam Á (SeABank), Hà Nội"
Senior HRBP (Female),Vietnam Australia International School (VAS),Thương lượng,"KĐT Sala, 1 Bùi Thiện Ngộ, An Khánh Ward, HCM City, 594 Ba Tháng Hai, Phường 14, Quận 10, TP. Hồ Chí Minh","KEY RESPONSIBILITIES:
The HR Business Partner (HRBP) will provide HR consultation and support to a Cluster/function assigned and fully dedicated to internal clients, their needs and their duties. The business partner identifies and prepares development plans for the key employees and high potential employees. The partner identifies employees ready for the promotion and rotates best talents across the cluster.
WORK DETAILS

1. Acts as an HR contact for the employees and managers at the cluster & proactively supports the delivery of HR Processes at the client’s side
2. Builds a strong business relationship with the Cluster Head and manage complex and difficult HR projects & plans in execution stage and then actively identifies gaps, proposes and implement changes necessary to cover risks
3. Coordinates with the Cluster Head in planning & monitoring staffing and recruiting the key talents for the cluster in charge and support them through probation, on board training, work orientation and retain them
4. Coordinating contract renewal & signing, leave, attendance & punctuality, KPI, package adjustment, resignation and facilitates HRD to bring best solutions for employees
5. .Recommending & follow up the succession plans for key talents and key job positions
6. In charge of rolling out company policy/regulation update training plan to employees in the client Cluster",Mức độ phù hợp và xếp hạng của bạn so với ứng viên khác như thế nào?,13/01/2026,Nhân Sự/Tuyển Dụng > Nhân Sự Tổng Hợp,Giáo dục/Đào Tạo,Không yêu cầu,Cử nhân,Không hiển thị,Không hiển thị,,Nhân viên,"Nhân Sự, Tuyển Dụng, C&B, HRBP, Human Resources",Tiếng Anh,Không hiển thị,Nữ,Không hiển thị,,Toàn thời gian,"Nhân Sự/Tuyển Dụng, Nhân Sự Tổng Hợp, Giáo dục/Đào Tạo, Nhân Sự, Tuyển Dụng, C&B, HRBP, Human Resources, Vietnam Australia International School (VAS), Hồ Chí Minh"
Lập Trình Viên,Trường Đại Học Kinh Tế - Tài Chính TPHCM,Thương lượng,"Hồ Chí Minh, Việt Nam, 141-145 Điện Biên Phủ, Phường 15, Quận Bình Thạnh, TP.HCM","• Phát triển và bảo trì các ứng dụng sử dụng .NET Core (API) theo kiến trúc Microservices.
• Viết code sạch, hiệu quả và có tài liệu hướng dẫn rõ ràng.
• Hợp tác với các thành viên trong nhóm để thiết kế và triển khai các tính năng mới.
• Tham gia vào quá trình xem xét code và cung cấp phản hồi.
• Gỡ lỗi và khắc phục sự cố trong các hệ thống hiện có.
• Làm việc với các cơ sở dữ liệu như SQL Server, PostgreSQL, và MongoDB.
• Sử dụng các cơ chế cache như Redis để tối ưu hóa hiệu suất.
• Containerize ứng dụng sử dụng Docker.
• Hỗ trợ thiết lập và duy trì các pipeline CI/CD trên GitHub hoặc GitLab.",Mức độ phù hợp và xếp hạng của bạn so với ứng viên khác như thế nào?,13/01/2026,Công Nghệ Thông Tin/Viễn Thông > Phần Mềm Máy Tính,Phần Mềm CNTT/Dịch vụ Phần mềm,2,,,,,Nhân viên,".Net Core, C#, Microservices, SQL, Redis",Bất kỳ,Không giới hạn,,,,,"Công Nghệ Thông Tin/Viễn Thông, Phần Mềm Máy Tính, Phần Mềm CNTT/Dịch vụ Phần mềm, .Net Core, C#, Microservices, SQL, Redis, Trường Đại Học Kinh Tế - Tài Chính TPHCM, Hồ Chí Minh"
Chuyên Viên Khách Hàng FDI Tiếng Trung / Tiếng Hàn,Bảo hiểm VietinBank (VBI),Thương lượng,"Hà Nội, Việt Nam, Tầng 10, 11 Tòa nhà 126 Đội Cấn - Quận Ba Đình - Hà Nội","Mô tả công việc
- Hỗ trợ chăm sóc và làm việc với khách hàng doanh nghiệp FDI của VBI.
- Phối hợp với các chi nhánh và các bộ phận liên quan trong quá trình triển khai công việc (sẽ được hướng dẫn, đào tạo).
- Tham gia các hoạt động bán hàng, chăm sóc khách hàng và chương trình kinh doanh theo kế hoạch của Công ty.
- Hỗ trợ theo dõi, tổng hợp thông tin và báo cáo công việc định kỳ.
- Thực hiện các công việc khác theo phân công của Lãnh đạo.",Mức độ phù hợp và xếp hạng của bạn so với ứng viên khác như thế nào?,13/01/2026,Ngân Hàng & Dịch Vụ Tài Chính > Quản Lý Quan Hệ Khách Hàng,Bảo hiểm,1,Cử nhân,Không hiển thị,Không hiển thị,09:00 - 18:00,Nhân viên,"Bảo Hiểm, Quản Lý Điều Hành, Thành thạo Tiếng Trung, Tiếng Anh, Đàm Phán Thương Lượng",Tiếng Việt,Không hiển thị,Không hiển thị,Không hiển thị,T2 - T6,Toàn thời gian,"Ngân Hàng & Dịch Vụ Tài Chính, Quản Lý Quan Hệ Khách Hàng, Bảo hiểm, Bảo Hiểm, Quản Lý Điều Hành, Thành thạo Tiếng Trung, Tiếng Anh, Đàm Phán Thương Lượng, Bảo hiểm VietinBank (VBI), Hà Nội"
Nhân Viên Mua Hàng Nước Ngoài / Xuất Nhập Khẩu,Puritech Vietnam Company Limited,Thương lượng,"Thôn An Lạc, xã Như Quỳnh, tỉnh Hưng Yên, Thôn An Lạc, xã Như Quỳnh, tỉnh Hưng Yên","Mô tả công việc
- Lập đơn đặt hàng (PO), theo dõi tiến độ giao hàng
- Xử lý các vấn đề phát sinh: chậm hàng, sai quy cách, thiếu số lượng
- Chuẩn bị và kiểm tra chứng từ XNK (hàng xuất, hàng nhập): invoice, packing list, BL, CO, tờ khai hải quan
- Phối hợp với forwarder để làm thủ tục thông quan
- theo dõi lịch tàu, lịch hàng về, cập nhật tiến độ
- kiểm tra chi phí XNK: cước vận chuyển, phí thông quan, VAT...",Mức độ phù hợp và xếp hạng của bạn so với ứng viên khác như thế nào?,13/01/2026,Hậu Cần/Xuất Nhập Khẩu/Kho Bãi > Xuất Nhập Khẩu & Thủ Tục Hải Quan,Dệt may/May mặc/Giày dép,1,Không giới hạn,Không hiển thị,Không hiển thị,08:00 - 17:00,Nhân viên,"Import-Export, Supplier Development, Báo Cáo Quyết Toán, Tờ Khai Hải Quan, Xuất nhập khẩu",Tiếng Việt,Không hiển thị,Không hiển thị,Không hiển thị,T2 - T6,Toàn thời gian,"Hậu Cần/Xuất Nhập Khẩu/Kho Bãi, Xuất Nhập Khẩu & Thủ Tục Hải Quan, Dệt may/May mặc/Giày dép, Import-Export, Supplier Development, Báo Cáo Quyết Toán, Tờ Khai Hải Quan, Xuất nhập khẩu, Puritech Vietnam Company Limited, Hưng Yên"
