Title,Company,Salary,Location,Job Description,Job Requirements,Date Posted,Industry,Field,Experience,Education,Age,Vacancy,Work Time,Level,Skills,Language,Nationality,Gender,Marital Status,Work Date,Work Type,Keyword
Chuyên Viên Cao Cấp Pháp Chế,GELEX Group,Thương lượng,"52 Lê Đại Hành, Q. Hai Bà Trưng, Hà Nội, Việt Nam, GELEX Tower 52 Lê Đại Hành – Q. Hai Bà Trưng – Hà Nội","1. Pháp lý hợp đồng:
• Tham gia thẩm định pháp lý (LDD), tư vấn pháp lý đối với giao dịch, hợp đồng phát sinh trong quá trình hoạt động của công ty, bao gồm các giao dịch đầu tư, thoái vốn, huy động vốn, các giao dịch kinh tế và dân sự khác.
• Tham gia xây dựng/thẩm định pháp lý về cấu trúc/phương án giao dịch.
• Soạn thảo, rà soát và chỉnh sửa các hợp đồng, giao dịch phát sinh có liên quan.
• Tham gia quá trình thương lượng, gặp gỡ các đối tác cùng với các phòng ban trong việc chỉnh sửa, thương lượng hợp đồng.
• Tham gia giải quyết tranh chấp khi có phát sinh.
2. Pháp lý dự án:
• Tham gia thẩm định pháp lý dự án, lập báo cáo thẩm định.
• Tư vấn cấu trúc mua bán dự án, hợp tác đầu tư dự án.
• Tư vấn thủ tục pháp lý đầu tư dự án, xây dựng công trình.
• Soạn thảo, rà soát, chỉnh sửa các văn bản, giấy tờ phát sinh trong quá trình đầu tư dự án, xây dựng công trình.
3. Pháp lý Quản trị nội bộ:
• Soạn thảo, sửa đổi các văn bản quản trị nội bộ của công ty và công ty thành viên.
• Rà soát và có ý kiến khi được yêu cầu đối với các quy chế, quy định, quy trình, hệ thống mẫu biểu, công văn, thông báo, tờ trình và các văn bản nội bộ khác của công ty và công ty thành viên.
• Tư vấn các vấn đề, tình huống pháp lý khác phát sinh trong mảng quản trị nội bộ công ty đại chúng.
• Cập nhật các thông tin mới về các Quy định, chính sách liên quan tới hoạt động Công ty để có những hướng dẫn/điều chỉnh kịp thời hạn chế rủi ro về mặt pháp lý.
4. Thực hiện công tác Kiểm soát tuân thủ và các công việc pháp lý khác theo phân công của Lãnh đạo Ban pháp chế.",Mức độ phù hợp và xếp hạng của bạn so với ứng viên khác như thế nào?,31/12/2025,Pháp Lý > Tư Vấn Pháp Lý,Sản xuất và Phân phối Điện/Khí đốt/Nước,3,Cử nhân,Không hiển thị,Không hiển thị,08:00 - 17:00,Nhân viên,"Pháp Lý Hợp Đồng, Tư Vấn Pháp Lý, Luật, Pháp Chế, Đầu Tư Tài Chính",Bất kỳ,Không hiển thị,Không hiển thị,Không hiển thị,T2 - T6,Toàn thời gian,"Pháp Lý, Tư Vấn Pháp Lý, Sản xuất và Phân phối Điện/Khí đốt/Nước, Pháp Lý Hợp Đồng, Tư Vấn Pháp Lý, Luật, Pháp Chế, Đầu Tư Tài Chính, GELEX Group, Hà Nội"
Sales Leader,Airspeed Manufacturing Vietnam LLC,Thương lượng,"Huyện Cần Giuộc, tỉnh Long An, Việt Nam, KCN Tân Kim, Huyện Cần Giuộc, T. Long An (cách trung tâm TP HCM 20km)","1. Develop and manage client relationships, and establish a deep and ongoing understanding of their business goals, challenges, and future needs.
2. Leverage a deep understanding of each client’s industry to identify and qualify forward-thinking and high-impact opportunities.
3. Collaborate with the internal technical teams to develop solutions that exceed client expectations.
4. Ensure the client has an amazing experience all the way through the sales cycle (listen, engage, and follow up).
5. Maintain ongoing sales funnel report with timely and accurate information.",Mức độ phù hợp và xếp hạng của bạn so với ứng viên khác như thế nào?,31/12/2025,Kỹ Thuật > Cơ Khí Tự Động Hoá,Sản xuất,8,Không giới hạn,Không hiển thị,Không hiển thị,,Trưởng phòng,"Tìm Kiếm Khách Hàng, Tiếng Anh, Kinh Doanh, Chăm Sóc Khách Hàng",Bất kỳ,Không hiển thị,Không hiển thị,Không hiển thị,,Toàn thời gian,"Kỹ Thuật, Cơ Khí Tự Động Hoá, Sản xuất, Tìm Kiếm Khách Hàng, Tiếng Anh, Kinh Doanh, Chăm Sóc Khách Hàng, Airspeed Manufacturing Vietnam LLC, Long An"
"Chuyên Viên, Chuyên Viên Cao Cấp Khoa Học Dữ Liệu - Data Scientist - Data Scientist - Khối Dữ Liệu (HO25.538)",Ngân Hàng Thương Mại Cổ Phần Quân Đội - MB,Thương lượng,"Số 18 Lê Văn Lương, phường Yên Hòa, Hà Nội, 19th – MB Building, No. 18 Le Van Luong Street, Yen Hoa Ward, Hanoi City","• Thực hiện các nhiệm vụ định kì của phòng theo lĩnh vực được phân công bao gồm: khai phá dữ liệu, phân tích chuyên sâu, xây dựng và làm giàu kho dữ liệu đặc trưng, phát triển mô hình phục vụ kinh doanh (tiềm năng bán, upsale, cross sale, chống churn ...)
• Thực hiện xây dựng và phát triển các mô hình phục vụ đáp ứng nhu cầu và hỗ trợ ra quyết định kinh doanh trên lĩnh vực được phân công
• Thực hiện công tác điều chỉnh, vận hành, tối ưu hóa các mô hình hiện hữu phục vụ đáp ứng nhu cầu và đạt hiệu quả kinh doanh cao.
• Tham gia và báo cáo lãnh đạo dự án, lãnh đạo khối các dự án về công tác xây dựng mô hình phân tích dữ liệu được phân công",Mức độ phù hợp và xếp hạng của bạn so với ứng viên khác như thế nào?,31/12/2025,Công Nghệ Thông Tin/Viễn Thông > Data Engineer/Data Analyst/AI,Ngân hàng,2,Cử nhân,Không hiển thị,1,,Nhân viên,"Data Science, Deep Learning, Deep Learning, Deep Learning, Machine Learning, MATLAB, PySpark",Bất kỳ,Không hiển thị,Không hiển thị,Không hiển thị,T2 - T6,Toàn thời gian,"Công Nghệ Thông Tin/Viễn Thông, Data Engineer/Data Analyst/AI, Ngân hàng, Data Science, Deep Learning, Deep Learning, Deep Learning, Machine Learning, MATLAB, PySpark, Ngân Hàng Thương Mại Cổ Phần Quân Đội - MB, Hà Nội"
Chief Accountant,Công Ty TNHH Kiểm Toán & Tư Vấn RSM Việt Nam / RSM Vietnam,Thương lượng,"phường Hòa Phú, Thành phố Thủ Dầu Một, Bình Dương, Việt Nam, L'MAK THE SIGNATURE, 147-147bisHai Bà Trưng, Vo Thi Sau Ward, Quận 3, Thành phố Hồ Chí Minh, Việt Na","Main Responsibilities: This role involves a range of responsibilities, including cost analysis, financial auditing, and reporting, aimed at enhancing our business operations. The ideal candidate will bring a strategic approach to managing financial transactions, ensuring accuracy and compliance, and contributing to the improvement of our accounting processes.
• Manage Financial and Accounting Transactions: Ensure all financial transactions are accurately and timely recorded and reported in line with Company procedures and policies, Vietnam Accounting Standards, and regulatory requirements.
• Financial Reporting: Ensure that all monthly, quarterly, and annual Financial reports are prepared in an accurate and timely manner.
• Financial Controls: Ensure that key Finance and Accounting controls are in place and effectively implemented throughout all accounting processes to maintain compliance with Vietnam Accounting Standards, as well as Direct and Indirect tax laws and regulations.
• Risk Management: Regularly review and assess financial and accounting risks, including testing of key controls, and address immediately any issue and/or violation identified.
• Tax Compliance: Ensure all local tax filing compliances (tax returns, declarations, documentation, or other filings) are prepared, reviewed, and submitted on time to avoid penalties and interest for errors, under-declarations, or delayed compliance.
• Main Point of Contact: Act as the main point of contact for handling financial information/ queries from internal/external auditors, tax authorities, government bodies, or any financial/accounting inquiries from the Head Office.
• Business Partner: Act as a business partner between the Company and its Head Office for all finance, accounting, and business-related matters.
• Cost Analysis: Analyze actual manufacturing costs and prepare periodic reports comparing actual costs to standard production costs.
• Audit and Review: Audit contracts, orders, and vouchers, and prepare reports to substantiate individual transactions before settlement.
• Approval of Transactions: Ensure proper handling of financial transactions and approve transactions within designated limits.
• Accounting Recommendations: Provide recommendations regarding the accounting treatment of reserves, assets, and expenditures.
• Additional Tasks: Perform other tasks as requested by the General Director from time to time.",Mức độ phù hợp và xếp hạng của bạn so với ứng viên khác như thế nào?,31/12/2025,Kế Toán/Kiểm Toán > Kế Toán Tài Chính,Sản xuất,3,Cử nhân,Không hiển thị,Không hiển thị,09:00 - 18:00,Nhân viên,"Accounting, Financial Reporting, Cost Analysis, Tax Compliance, Risk Management",Tiếng Anh,Không hiển thị,Không hiển thị,Không hiển thị,T2 - T6,Toàn thời gian,"Kế Toán/Kiểm Toán, Kế Toán Tài Chính, Sản xuất, Accounting, Financial Reporting, Cost Analysis, Tax Compliance, Risk Management, Công Ty TNHH Kiểm Toán & Tư Vấn RSM Việt Nam / RSM Vietnam, Bình Dương"
Kỹ Sư SMT - Ưu Tiên Tiếng Trung Giao Tiếp,Công Ty TNHH Điện Tử Longcheer Meiko Việt Nam,"$ 600-1,000 /tháng","Khu công nghiệp Quang Minh, tt. Quang Minh, Mê Linh, Hà Nội, Việt Nam, Lô 37-2, Khu công nghiệp Quang Minh, Thị trấn Quang Minh, Huyện Mê Linh, thành phố Hà Nội","Phụ trách quản lý, bảo trì, điều chỉnh và tối ưu thông số thiết bị điểm keo / dán linh kiện / test của sản phẩm iPad
Phối hợp với bộ phận PQE, ME, PE, QA để xử lý sự cố thiết bị và cải thiện chất lượng quy trình.
Theo dõi dữ liệu thiết bị, phân tích nguyên nhân lỗi máy hoặc sai lệch quy trình, thực hiện cải tiến để nâng cao tỷ lệ đạt.
Hỗ trợ build EVT/DVT/PVT/MP cho sản phẩm mới, xác nhận tính ổn định của thiết bị trước sản xuất hàng loạt.
Lập báo cáo hoạt động, kế hoạch bảo trì định kỳ và hướng dẫn vận hành thiết bị cho công nhân line.
Thực hiện các công việc khác theo phân công của cấp trên.",Mức độ phù hợp và xếp hạng của bạn so với ứng viên khác như thế nào?,31/12/2025,Khoa Học & Kỹ Thuật > Kỹ Thuật Điện/Điện Tử,Điện/Điện tử,2,,,,,Nhân viên,"Tiếng Trung Giao Tiếp, SMT, AOI, VR/AR, FUJI NXT placement machines",Tiếng Trung Quốc,Người Việt Nam,,,,,"Khoa Học & Kỹ Thuật, Kỹ Thuật Điện/Điện Tử, Điện/Điện tử, Tiếng Trung Giao Tiếp, SMT, AOI, VR/AR, FUJI NXT placement machines, Công Ty TNHH Điện Tử Longcheer Meiko Việt Nam, Hà Nội"
"Gấp! Engineering Staff (English Speaking, Shutter Bus from Ha Noi; Hai Duong - Hung Yen)","Nikkiso Vietnam, Inc.",$ 400-700 /tháng,"Lot C6 & C7 THĂNG LONG IP2, LIÊU XÁ, YÊN MỸ, HƯNG YÊN, Hải Dương, Việt Nam, Hà Nội, Vietnam, Thang Long Industrial Park II, Nguyen Van Linh Commune and Duong Hao Ward, Hung Yen province","Bạn có muốn trở thành một phần trong ngành công nghiệp hàng không – nơi mỗi chi tiết đều góp phần làm nên những chuyến bay an toàn?

Tại NIKKISO VIETNAM, INC., công ty 100% vốn Nhật Bản, chúng tôi tự hào là nhà sản xuất linh kiện máy bay với công nghệ tiên tiến và tiêu chuẩn toàn cầu.
Chúng tôi tin rằng con người là trung tâm của sự phát triển – nơi mỗi cá nhân đều được học hỏi, sáng tạo và tỏa sáng.

Gia nhập Nikkiso ngay hôm nay! Bạn không chỉ có một công việc, mà còn là cơ hội để khẳng định bản thân trong ngành công nghiệp đòi hỏi chính xác, trách nhiệm và đổi mới không ngừng.

Địa điểm làm việc: Thang Long Industrial Park II, Hung Yen
(Xe đưa đón từ Hà Nội, Hải Dương đến Hưng Yên)

Why You’ll Love Working Here

1. Thu nhập xứng đáng & Trợ cấp hấp dẫn:
- Lương cạnh tranh (Fresh ~9,961 triệu, Staff đến 20 triệu)",,31/12/2025,Khoa Học & Kỹ Thuật > Kỹ Thuật Điện/Điện Tử,Sản xuất,1,,,,,Mới Tốt Nghiệp,"English, CAD Design, Engineering, Maintenance, Process Improvement",Tiếng Anh,Không hiển thị,,,,,"Khoa Học & Kỹ Thuật, Kỹ Thuật Điện/Điện Tử, Sản xuất, English, CAD Design, Engineering, Maintenance, Process Improvement, Nikkiso Vietnam, Inc., Hưng Yên, Hải Dương, Hà Nội"
Trưởng Ban Đầu Tư,TNHH LẠC VIỆT QUY NHƠN,Thương lượng,"33 Tràng Thi, Hoàn Kiếm, Hà Nội, Số 6, Khu Phố, Phú Hậu, Phù Cát, Bình Định","MỤC TIÊU CÔNG VIỆC
• Tìm kiếm cơ hội và xây dựng các chiến lược đầu tư;
• Thực hiện, quản lý và đánh giá các dự án đầu tư doanh nghiệp;
• Tham mưu cho Ban Lãnh đạo các hoạt động liên quan đến đầu tư.""

NHIỆM VỤ CHÍNH
• Phối hợp xây dựng phương án xác định tiền sử dụng đất, tiền thuê đất theo quy định hiện hành.
• Phân tích hiệu quả đầu tư với các dự án đang thực hiện;
• Thực hiện xin giấy phép đầu tư.
• Lập bảng tính, mô hình tài chính liên quan đến tiền sử dụng đất, hệ số điều chỉnh giá đất, phương pháp thặng dư, so sánh, chiết trừ (khi áp dụng).
• Làm việc với đơn vị tư vấn thẩm định giá, cơ quan nhà nước có thẩm quyền để hoàn thiện hồ sơ xác định nghĩa vụ tài chính về đất đai.
• Tổng hợp, phân tích tác động của chi phí đất đai đến tổng mức đầu tư và hiệu quả tài chính dự án.
• Theo dõi, cập nhật các quy định pháp luật liên quan đến đất đai, giá đất, tài chính đất đai.
• Các nhiệm vụ khác theo sự phân công của Ban Lãnh đạo.",Mức độ phù hợp và xếp hạng của bạn so với ứng viên khác như thế nào?,31/12/2025,Bất Động Sản > Phát Triển Bất Động Sản,Bất Động Sản/Cho thuê,3,Cử nhân,Không hiển thị,Không hiển thị,08:00 - 17:00,Trưởng phòng,"Pháp Lý Dự Án, Luật, Bất Động Sản, Giải Phóng Mặt Bằng, Luật Đầu Tư",Tiếng Việt,Không hiển thị,Không hiển thị,Không hiển thị,,Toàn thời gian,"Bất Động Sản, Phát Triển Bất Động Sản, Bất Động Sản/Cho thuê, Pháp Lý Dự Án, Luật, Bất Động Sản, Giải Phóng Mặt Bằng, Luật Đầu Tư, TNHH LẠC VIỆT QUY NHƠN, Hà Nội"
O&M Engineer,Công Ty TNHH Lys Energy (Việt Nam),Thương lượng,"Hồ Chí Minh, Vietnam, Số 2-4-6 Đường số 5, Khu đô thị Sala, Phường An Khánh, TP.Hồ Chí Minh","The O&M Engineer is primarily responsible for plant operations and maintenance. The individual requires to lead and supervise contractors in carrying out preventive, corrective and other maintenance ensuring the highest standards is adhered to. In addition, the individual is also accountable for plant operations activities such as performance monitoring, data analysis, power control, grid compliance and invoice preparation. The individual will support testing and commissioning and quality checks for project under installation.

• Conduct periodic inspections and preventive maintenance activities for rooftop solar power systems in accordance with the maintenance plan of assigned projects.
• Ensure corrective maintenance is done effective and swiftly to ensure the system operates safely, reliably, and efficiently.
• Monitoring operation status and system parameters of operating projects; Identify and resolve equipment malfunctions and technical faults within a short response time.
• Oversee O&M contractors to ensure strict compliance with safety measures required by the company and the client’s factories.
• Track and document all faults in fault log, ensuring all fault is addressed.
• Prepare incident reports and preventive maintenance reports for assigned projects.
• Testing and commissioning and quality checks for newly installed projects.
• Propose a list of spare parts and backup equipment required for each project.
• Perform monthly electricity billing calculations for customers in accordance with PPA contracts.",Mức độ phù hợp và xếp hạng của bạn so với ứng viên khác như thế nào?,31/12/2025,Khoa Học & Kỹ Thuật > Kỹ Thuật Điện/Điện Tử,Điện/Điện tử,2,Không giới hạn,Không hiển thị,Không hiển thị,,Nhân viên,"Electrical Systems, O&M, Electromechanics, Solar Energy, Sử Dụng Pvsyst",Tiếng Anh,Không hiển thị,Không hiển thị,Không hiển thị,,Toàn thời gian,"Khoa Học & Kỹ Thuật, Kỹ Thuật Điện/Điện Tử, Điện/Điện tử, Electrical Systems, O&M, Electromechanics, Solar Energy, Sử Dụng Pvsyst, Công Ty TNHH Lys Energy (Việt Nam), Hồ Chí Minh"
Trưởng Phòng Kinh Doanh Ngành Hàng Tấm Ván Nhựa PVC (Vật Liệu Nhựa Nội Thất),Cty TNHH Sản Xuất Thương Mại Nhựa Đại Việt,Thương lượng,"Tầng 8 Thăng Long Tower, 98 Ngụy Như Kon Tum, Thanh Xuân, Hà Nội, Cụm CN Quất Động mở rộng, Thường Tín, Hà Nội","I. MỤC ĐÍCH CÔNG VIỆC/ VỊ TRÍ:
- Xây dựng và triển khai chiến lược kinh doanh hiệu quả cho các dòng sản phẩm Tấm ván nhựa PVC, Tấm than tre
- Xây dựng và phát triển hệ thống Khách hàng OEM, Nhà phân phối, Đại lý, Xưởng thi công, Dự án
- Đảm bảo doanh số, độ phủ thị trường theo kế hoạch được giao
II. NHIỆM VỤ:
1. Chiến lược kinh doanh
- Lập kế hoạch kinh doanh tháng, quý, năm cho ngành Tấm ván nhựa PVC, Tấm than tre.
- Phân tích thị trường, đối thủ cạnh tranh: Gỗ công nghiệp, Nhựa rỗng, Nhôm, Inox,…
- Định hướng danh mục sản phẩm chủ lực theo từng phân khúc sản phẩm
2. Quản lý Doanh số và thị trường
- Chịu trách nhiệm chỉ tiêu doanh số toàn bộ ngành Tấm ván nhựa PVC, Tấm than tre
- Theo dõi, phân tích số liệu bán hàng, tồn kho
- Điều chỉnh chính sách bán hàng theo biến động thị trường
3. Phát triển hệ thống phân phối
- Phát triển các khách hàng OEM theo thương hiệu và yêu cầu riêng biệt
- Tuyển chọn, xây dựng và quản lý NPP theo nhãn hiệu của Công ty
- Giải quyết xung đột kênh phân phối, đảm bảo tính bền vững",,31/12/2025,Kinh Doanh > Bán Hàng/Phát Triển Kinh Doanh,Sản xuất,3,,,,,Trưởng phòng,"Lập Kế Hoạch, Quản Lý Đội Nhóm, Phân Tích Kinh Doanh, Đàm Phán, Kế Hoạch Kinh Doanh",Bất kỳ,Không hiển thị,,,,,"Kinh Doanh, Bán Hàng/Phát Triển Kinh Doanh, Sản xuất, Lập Kế Hoạch, Quản Lý Đội Nhóm, Phân Tích Kinh Doanh, Đàm Phán, Kế Hoạch Kinh Doanh, Cty TNHH Sản Xuất Thương Mại Nhựa Đại Việt, Hà Nội"
Learning And Development Specialist,GSM,Thương lượng,"Ha Noi, Symphony Office, đường Chu Huy Mân, Long Biên, Hà Nội","1. Job Purpose
1.1. Training Delivery:
• Conduct onboarding programs, service operations training, process training, and soft skills sessions
• Deliver training content in an engaging, practical, and easy-to-understand manner.
• Maintain classroom discipline and create a positive, motivating learning environment.
• Training management: evaluate training actitvitites of market/country and have the action plan to improve
1.2. Class Preparation & Coordination:
• Collaborate with training coordinators to prepare training materials, equipment, venues, attendance, and evaluation activities.
• Contribute ideas to enhance training content, teaching methods, and training materials.
1.3. Assessment & Reporting:
• Conduct assessments and evaluate trainee performance upon course completion.
• Consolidate feedback, prepare training reports, and propose improvements to elevate training quality.
1.4. Support Activities & Travel:
• Deliver training in other provinces/cities as assigned.
• Support internal training initiatives, train-the-trainer programs, and other training projects of the department.",Mức độ phù hợp và xếp hạng của bạn so với ứng viên khác như thế nào?,31/12/2025,Nhân Sự/Tuyển Dụng > Đào Tạo Và Phát Triển,Vận tải,2,Cử nhân,Không hiển thị,Không hiển thị,,Nhân viên,"Training Program, Training Organizing, Training, Human Resources, E-Learning",Bất kỳ,Không hiển thị,Không hiển thị,Không hiển thị,,Toàn thời gian,"Nhân Sự/Tuyển Dụng, Đào Tạo Và Phát Triển, Vận tải, Training Program, Training Organizing, Training, Human Resources, E-Learning, GSM, Hà Nội"
Kỹ Sư Shop-Drawing,CÔNG TY TNHH PENROZ PHÁP VIỆT,Thương lượng,"25 Bàu Cát 2, Tân Bình, Quận Tân Bình, Thành phố Hồ Chí Minh | Quận Nam Từ Liêm, Hà Nội","• Triển khai bản vẽ thi công cốt thép (Rebar) từ thiết kế kỹ thuật.
• Phối hợp với các bộ môn khác để đảm bảo bản vẽ shopdrawing đầy đủ và chính xác.
• Làm việc 100% thời gian trên các dự án nước ngoài.
• Làm việc với AutoCAD.",Mức độ phù hợp và xếp hạng của bạn so với ứng viên khác như thế nào?,31/12/2025,Kiến Trúc/Xây Dựng > Xây Dựng,Kỹ thuật xây dựng/Cơ sở hạ tầng,Không yêu cầu,,,,,Nhân viên,"Autocad, Building Structure Design, Construction, Engineering, Shop Drawings, Shop Drawings, Shop Drawings",Bất kỳ,Không giới hạn,,,,,"Kiến Trúc/Xây Dựng, Xây Dựng, Kỹ thuật xây dựng/Cơ sở hạ tầng, Autocad, Building Structure Design, Construction, Engineering, Shop Drawings, Shop Drawings, Shop Drawings, CÔNG TY TNHH PENROZ PHÁP VIỆT, Hồ Chí Minh"
Nhân Viên Kinh Doanh (Technical Sales),VPĐD Công Ty TNHH Sản Xuất Thương Mại Amigos,Thương lượng,"Tòa nhà Khu Công Nghiệp Vĩnh Lộc, Phòng 406, lô A59/I, Đường số 7, Quận Bình Tân, Tòa nhà Khu Công Nghiệp Vĩnh Lộc, lô A59/I, Đường số 7, Phường Bình Hưng Hòa B, Quận Bình Tân, TP HCM","1. Nắm bắt tốt, hiểu biết rõ về các sản phẩm hóa chất, phụ gia, thành phẩm trong ngành phân bón, thuốc bảo vệ thực vật.
2. Tiếp nhận, chăm sóc một số khách hàng sẵn có của công ty để phát triển doanh số mới.
3. Tìm kiếm, phát triển khách hàng mới.
4. Tư vấn kỹ thuật, sản phẩm một cách hiệu quả để giúp khách hàng chọn được giải pháp phù hợp.
5. Lập kế hoạch đi chăm sóc, gặp gỡ trực tiếp khách hàng định kỳ (tuần/tháng)
6. Khảo sát nhu cầu thị trường, cập nhật các xu hướng mới và đề xuất sản phẩm mới tiềm năng.
7. Phân tích, đánh giá các đơn vị cạnh tranh trong ngành và đề xuất phương án thích ứng.
8. Quản lý đơn hàng và nợ khách hàng (theo dõi trên phần mềm bán hàng).
9. Thực hiện yêu cầu, nhiệm vụ được cấp trên giao (báo cáo định kỳ, ngày, hàng tuần, hàng tháng, báo cáo theo chuyên đề, ...).",Mức độ phù hợp và xếp hạng của bạn so với ứng viên khác như thế nào?,31/12/2025,Kinh Doanh > Bán Hàng Kỹ Thuật,Hoá chất/Hoá sinh,1,Không giới hạn,Không hiển thị,1,,Nhân viên,"Chăm Sóc Khách Hàng, Tìm Kiếm Khách Hàng, Xây Dựng Mối Quan Hệ, Khảo Sát Thị Trường, Quản Lý Đơn Hàng",Bất kỳ,Không giới hạn,Bất kỳ,Bất kỳ,,Toàn thời gian,"Kinh Doanh, Bán Hàng Kỹ Thuật, Hoá chất/Hoá sinh, Chăm Sóc Khách Hàng, Tìm Kiếm Khách Hàng, Xây Dựng Mối Quan Hệ, Khảo Sát Thị Trường, Quản Lý Đơn Hàng, VPĐD Công Ty TNHH Sản Xuất Thương Mại Amigos, Hồ Chí Minh"
