Title,Company,Salary,Location,Job Description,Job Requirements,Date Posted,Industry,Field,Experience,Education,Age,Vacancy,Work Time,Level,Skills,Language,Nationality,Gender,Marital Status,Work Date,Work Type,Keyword
Marketing and Communications Manager,Trường Quốc Tế Đức Thành Phố Hồ Chí Minh,Thương lượng,"12 Vo Truong Toan St., An Phu Ward, Thu Duc City, HCMC (D2), 12 Vo Truong Toan St., An Phu Ward, Thu Duc City, HCMC (D2)","*Duties
Communications:
• Lead communications and marketing for the School, leading the development of a comprehensive annual Marketing and Communication Strategy to be followed, and ensuring that these are effective in delivering noticeable success and traction with relevant audiences;
• Ensure the brand is prominent and adheres to agreed brand guidelines across all communication channels;
• Assist staff in the application of the School’s visual identity to their documents whether through providing guidelines or via developing templates, in association with Graphic Designer;
• Maintain databases of key stakeholders and manage regular communication via a variety of different media channels;
• Keep abreast of innovations in communications and marketing and recommend appropriate enhancements for implementation;
• Coordinate with the Graphic Designer appropriate digital and printed marketing materials consistent with the needs and
expectations of all stakeholders;
• Maintain stocks of marketing materials and equipment, ensuring that they are displayed at appropriate points throughout the School and available for events
• Maintain an up-to-date presence through the school’s website, relating to schools events and news.
• Ensure that noteworthy activities are communicated and/or celebrated to internal and external stakeholders and prospective
audiences, ensuring a sense of pride and satisfaction accordingly;
• Perform marketing research to find new opportunities and analysing market trends and conducting competitor research;
• Manage budgets for annual Marketing and Communication Plans;
• Design, manage, evaluate and analyze outcomes of marketing campaigns
• Collaborate closely with admissions team on a Lead Generation Plan that is transparent to all and effective.
• Update effective internal communication channels to inform students and faculty of school events, successes etc;
• Directing the school’s social media engagement strategy;
• To attend Marketing, Admissions and Communication Team meetings, liaising with senior school leaders for school success
stories, reporting on action plans and their effectiveness.

Written Communications and Press Releases
• Draft and edit press releases and school advertisements/advertorials, digital and print materials;
• Write interesting, creative, engaging and accurate articles for a range of audiences, liaising with the Copy Writer;
• Assist in the production of promotional materials and relevant communications for school events including, but not limited to, student academic/artistic exhibitions, music concerts;
• Assist with the creation of written resources to celebrate and promote the School’s unique history, ethos and educational
initiatives to prospective families, the wider community, societies and alumni;
• Research and place orders for suitable, branded, promotional items;
• Coordinate in the planning and organisation of promotional and recruitment events;
• Attend recruitment events and shows.
• Produce an advertising plan, including gathering information about audiences and rates for different options.
• Assist with the production of a School Year Book, Handbooks and school Profile, and other school publications.
Website and IT platforms:
• Management of the School website, with the relevant School Support and Services staff;
• Maintain an accurate Events Calendar for use by internal and external stakeholders;
• Liaise with to Head of School in maintaining an accurate Whole School Calendar;
• Inform Faculty staff of calendar changes, important messages and engaging content, including news, sport, events, videos and photographs.
• Utilise new media technologies to deliver website visitors and increase online visibility;
• Ensure all content is accurate and timely, working closely with the Copy Writer;
• Create, maintain and update video content for the School website on a regular basis;
• Create and maintain booking procedures and protocols for a range of events that take place throughout the year, produce email responses and maintain contact with future attendees;
• Ensure search engine optimization, in conjunction with the Website Manager;
• Maintain databases for, and content on, third party websites to ensure information is up-to-date and accurate at all times;
• Keep up-to-date with innovations in digital marketing and make recommendations, as appropriate;
• In conjunction with the copywriter, write and oversee the production of content that drives traffic to the school’s website;
• Work with all faculty staff to ensure that each department is represented appropriately to external stakeholders

Digital Marketing:
• Gather information for and then produce a range of weekly and periodic e-newsletters to stakeholders;
• Maintain a digital photographic library, including taking photos of School events and booking and organising professional
photography/videography, as required, in conjunction with the Events Coordinator;
• Determine the scope and quality of photographs required for promotional and communications use;
• Manage the School’s social media accounts, including maintaining the social media strategy and monitoring the School’s online presence;
• Produce monthly reports on effectiveness of social media posts
• Support academic staff with school social media advice/account management, carrying out training sessions, as appropriate.
Monitor staff content for appropriateness to school brand guidelines and policy;
• Produce e-invitations and use MailChimp and/or Outlook to send these to a maintained database
• Use the most appropriate tools for scheduling, tracking and producing digital communications;
• Use online survey software, such as Survey Monkey, to gather feedback on events and marketing activities, and send annual
surveys to key stakeholders;
• Produce online advertising as part of agreed campaigns;
• Update the School’s digital information screens with messages, as required.
• Any other tasks reasonably assigned by the Head of Administratoin.",Mức độ phù hợp và xếp hạng của bạn so với ứng viên khác như thế nào?,27/01/2026,"Tiếp Thị, Quảng Cáo/Truyền Thông > Tiếp Thị",Giáo dục/Đào Tạo,3,Cử nhân,25-35,Không hiển thị,,Trưởng phòng,"Marketing, Strategic Communications, English, Marketing Planning, Press Release",Tiếng Anh,Không giới hạn,Bất kỳ,Bất kỳ,,Toàn thời gian,"Tiếp Thị, Quảng Cáo/Truyền Thông, Tiếp Thị, Giáo dục/Đào Tạo, Marketing, Strategic Communications, English, Marketing Planning, Press Release, Trường Quốc Tế Đức Thành Phố Hồ Chí Minh, Hồ Chí Minh"
HRGA Supervisor,Công Ty TNHH Canon Marketing Việt Nam,Thương lượng,"Zen Plaza, 54-56 Nguyễn Trãi, Phường Bến Thành, TPHCM, Zen Plaza, 54-56 Nguyễn Trãi, Phường Bến Thành, TPHCM","***General Administration (GA) – 20%
• Front Office & Hospitality: Act as the face of the company by welcoming guests and providing necessary support during their visit.
• Logistics & Travel: Coordinate international business trip arrangements, including flight bookings and hotel reservations.
• Procurement: Support office supply procurement and vendor management.
• Event Coordination: Assist in organizing company events, workshops, and staff engagement activities.
• Reporting: Prepare and submit GA-related reports as requested.

***HR Operations & Compliance – 50%
• Talent Flow: Support the recruitment process and execute seamless onboarding/offboarding for employees.
• Documentation: Collect, organize, and archive labor-related documents and contracts.
• Database Management: Maintain and update the CMV Master Database to ensure 100% data accuracy.
• Expat Support: Handle legal documentation for foreign employees (CMV & CMA), including Visas, Work Permits, and Residence Cards.
• C&B Support: Assist in payroll data preparation, Social Insurance (SHUI), and Personal Income Tax (PIT) filings; Assist in executing staff welfare activities.
• Finance Tracking: Verify HR-related invoices and track monthly accruals/payments to ensure budget alignment.
• Reporting: Prepare and submit HR-related reports as requested.

***HR Systems – 20%
• System Operation: Perform daily tasks on HR system platforms (specifically BIPO) and assist in transitioning to new HR systems as required.

***Other task assigned by HRGA Head (10%)",Mức độ phù hợp và xếp hạng của bạn so với ứng viên khác như thế nào?,,,,,,,,,,,,,,,,,"Nhân Sự/Tuyển Dụng, Nhân Sự Tổng Hợp, Bán lẻ/Bán sỉ, Front Office Support, General Administration, HR Operation, HRGA, Procurement, Công Ty TNHH Canon Marketing Việt Nam, Hồ Chí Minh"
[Hà Nội] Chuyên viên cao cấp Phòng chống rửa tiền,Ngân hàng Lộc Phát Việt Nam LPBank,Thương lượng,"LPB Tower Số 210 Trần Quang Khải, Phường Hoàn Kiếm, Hà Nội, LPB Tower, số 210 đường Trần Quang Khải, Phường Hoàn Kiếm, Thành phố Hà Nội","1. Xây dựng và quản lý chính sách, quy định nội bộ về PCRT
- Tham gia xây dựng chính sách, quy định, công cụ hỗ trợ về PCRT, TTKB, TTPBVK, TTCV, FATCA theo đúng quy định pháp luật và chính sách ngân hàng.
- Đầu mối rà soát, cập nhật quy trình, quy định nội bộ để đảm bảo đồng bộ với quy định pháp luật và chỉ đạo từ NHNN.

2. Đánh giá rủi ro và giám sát khách hàng, giao dịch
- Thực hiện đánh giá rủi ro rửa tiền, TTKB, TTPBVK và TTCV đối với khách hàng, giao dịch, đối tác.
- Giám sát giao dịch đáng ngờ qua hệ thống PCRT và báo cáo từ các đơn vị liên quan.
- Đề xuất biện pháp kiểm soát rủi ro phù hợp nhằm giảm thiểu nguy cơ trong hoạt động ngân hàng.

3. Quản lý thông tin và phối hợp cung cấp dữ liệu
- Quản lý thông tin, hồ sơ khách hàng và giao dịch, cung cấp cho cơ quan nhà nước theo yêu cầu.
- Phối hợp với các đơn vị nội bộ để thu thập, xử lý thông tin PCRT.
- Vận hành và quản trị phần mềm AML/FATCA phục vụ công tác PCRT.

4. Báo cáo và quản lý thông tin liên quan đến PCRT
- Chuẩn bị bảo cáo định kỳ và đột xuất về PCRT, TTKB, TTPBVK, TTCV và FATCA
cho NHNN và cơ quan nhà nước
- Tổng hợp và cung cấp báo cáo đánh giá rủi ro PCRT trong toàn hệ thống

5. Đào tạo, tuyên truyền và nâng cao nhận thức
- Xây dựng tài liệu đào tạo và triển khai kế hoạch nâng cao nhận thức về PCRT, TTKB, TTPBVK, TTCV cho các đơn vị trong hệ thống.
- Tham gia các khóa đào tạo chuyên môn bên ngoài để cập nhật kiến thức và quy định mới.

6. Phòng, chống khủng bố
- Tham gia xây dựng phương án phòng, chống khủng bố và kế hoạch diễn tập tại ngân hàng.
- Phối hợp triển khai kế hoạch phòng, chống khủng bố và xử lý hậu quả khi xảy ra sự cố theo chỉ đạo của NHNN và cơ quan nhà nước.

7. Nghiên cứu, đánh giá tác động pháp lý
- Nghiên cứu, đánh giá tác động của các quy định pháp luật mới về PCRT, TTKB, TTPBVK, TTCV đối với hoạt động ngân hàng.
- Đề xuất giải pháp, công cụ nghiệp vụ đảm bảo tuần thủ pháp luật và chính sách ngân hàng.",Mức độ phù hợp và xếp hạng của bạn so với ứng viên khác như thế nào?,27/01/2026,Ngân Hàng & Dịch Vụ Tài Chính > Tuân Thủ & Kiểm Soát Rủi Ro,Ngân hàng,4,Cử nhân,15-60,1,9:00 - 18:00,Nhân viên,"Anti–Money Laundering, Chống Rửa Tiền, Pháp Lý, Quản Trị Rủi Ro, Risk Management",Bất kỳ,Không giới hạn,Bất kỳ,Bất kỳ,T2 - T6,Toàn thời gian,"Ngân Hàng & Dịch Vụ Tài Chính, Tuân Thủ & Kiểm Soát Rủi Ro, Ngân hàng, Anti–Money Laundering, Chống Rửa Tiền, Pháp Lý, Quản Trị Rủi Ro, Risk Management, Ngân hàng Lộc Phát Việt Nam LPBank, Hà Nội"
Textile Sales Representative,Navigos Search,Thương lượng,"Hà Nội, Việt Nam, Hanoi / HCMC","* The Textile Sales Representative is responsible for driving sales of fabric products, including Polyester and Nylon, by developing new business opportunities and strengthening long-term client partnerships. 
* This role involves delivering tailored product solutions, managing the full sales cycle, monitoring market dynamics, and representing the company at industry events. 
* The position requires strong relationship-building skills, commercial acumen, and a customer-focused mindset, with regular travel to meet clients and attend trade exhibitions.
* Key Responsibilities
- Business Development: Identify, engage, and secure new customers while growing revenue from existing accounts.
- Client Management: Build and maintain strong relationships through regular communication, needs assessment, and solution-oriented support.
- Product Knowledge: Provide expert consultation on fabric categories, constructions, sustainability attributes, and technical performance features.
- Market Intelligence: Analyze market trends, competitor activities, and pricing strategies to develop competitive and value-driven proposals.
- Sales Operations: Manage the end-to-end order process, including quotations, contract negotiation, inventory coordination, and delivery follow-up.
- Industry Engagement: Represent the company at trade shows, exhibitions, and fashion industry events to promote products and expand networks.",Mức độ phù hợp và xếp hạng của bạn so với ứng viên khác như thế nào?,27/01/2026,Kinh Doanh > Bán Hàng/Phát Triển Kinh Doanh,Thời trang/Trang sức,5,Cử nhân,Không hiển thị,Không hiển thị,07:30 - 16:30,Nhân viên,"Communication, IT Knowledge, Interpersonal skills, Technical skills, Problem-solving",Bất kỳ,Không hiển thị,Không hiển thị,Không hiển thị,T2 - T7,Toàn thời gian,"Kinh Doanh, Bán Hàng/Phát Triển Kinh Doanh, Thời trang/Trang sức, Communication, IT Knowledge, Interpersonal skills, Technical skills, Problem-solving, Navigos Search, Hà Nội"
HO - Chuyên viên/Chuyên viên chính/Chuyên viên cao cấp Quản lý dữ liệu tài chính (MIS),Ngân hàng Lộc Phát Việt Nam LPBank,Thương lượng,"LPB Tower Số 210 Trần Quang Khải, Phường Hoàn Kiếm, Hà Nội, LPB Tower, số 210 đường Trần Quang Khải, Phường Hoàn Kiếm, Thành phố Hà Nội","- Xây dựng các nguyên tắc quản trị dữ liệu liên quan đến chuyên môn nghiệp vụ tài chính, bảng dữ liệu tài chính (datamart), các từ điển dữ liệu tài chính.
- Quản lý danh mục master data, các bảng mapping dữ liệu, các bộ code liên quan đến Khối Thị trường và Quản trị tài chính (TT&QTTC)
- Tiếp nhận và tổng hợp yêu cầu phát triển về bảng dữ liệu, báo cáo, sản phẩm dịch vụ CNTT từ các Đơn vị trong Khối TT&QTTC
- Phân tích yêu cầu, hoàn thiện tài liệu phân tích, phân tích kiểm thử và xây dựng, tự động hóa, cung cấp các bảng dữ liệu định kỳ làm đầu vào cho các báo cáo phân tích của Khối Tài chính theo yêu cầu của các Đơn vị Nghiệp vụ thuộc Khối TT&QTTC
- Đầu mối phối hợp giữa các bộ phận nghiệp vụ trong Khối Tài chính để xây dựng mô tả (BRD) và thử nghiệm (UAT) cho các yêu cầu được Khối CNTT và Văn phòng Chuyển đổi phát triển đảm bảo các yêu cầu phát triển cơ sở dữ liệu/báo cáo/giải pháp được phân tích rõ ràng, chính xác và hoàn thành đúng tiến độ yêu cầu.
- Vận hành các chốt kiểm soát dữ liệu của Khối Tài chính, đảm bảo hệ thống dữ liệu vận hành hiệu quả, đáp ứng yêu cầu của nghiệp vụ; các lỗi dữ liệu được phát hiện kịp thời, xử lý nhanh chóng.
- Lưu trữ, phát triển, cập nhật và duy trì kho dữ liệu thông tin tài chính qua các thời kỳ của LPBank.
- Tham gia các dự án của Khối và của LPBank có liên quan đến dữ liệu và báo cáo tài chính.
- Thực hiện các nhiệm vụ khác theo sự phân công của Ban Giám đốc Khối và lãnh đạo LPBank.",Mức độ phù hợp và xếp hạng của bạn so với ứng viên khác như thế nào?,,,,,,,,,,,,,,,,,"Ngân Hàng & Dịch Vụ Tài Chính, Tín Dụng, Ngân hàng, Mô Phỏng Phân Tích, MIS, Power BI, Python, SQL, Ngân hàng Lộc Phát Việt Nam LPBank, Hà Nội"
IT Operations Engineer,Vietnam Australia International School (Vas),Thương lượng,,,,,,,,,,,,,,,,,,,,"Công Nghệ Thông Tin/Viễn Thông, System/Cloud/DevOps Engineer, Giáo dục/Đào Tạo, Computer Science, IT Operations, Cloud, CCNA, Firewall, Vietnam Australia International School (Vas), Hồ Chí Minh"
General Services & Administration Supervisor,CÔNG TY TNHH EISAI VIỆT NAM,Thương lượng,"Ho Chi Minh City, Vietnam, Tầng 8, Tòa nhà Sài Gòn Giải Phóng, 436-438 Nguyễn Thị Minh Khai, Phường 05, Quận 3, TP Hồ Chí Minh","1. Office Operations
- Ensure smooth daily operation of the HCMC office including cleanliness and utilities.
- Monitor and replenish office supplies, pantry stock, and stationery.
- Manage service contracts and performance of third-party vendors (cleaning, repair, courier, water, etc…)
- Coordinate regular maintenance and repairs of office equipment and furniture.
- Coordinate onboarding for new staff, including desk setup, welcome kits, and orientation.
- Track office utility usage and support budget planning for both Ho Chi Minh and Hanoi Office

2. Administrative & Documentation Support
- Prepare PR/POs in accordance with SOPs (CNS & General BU, HR Department)
- Follow up on payment requests for congresses, sponsorships, or personal expenses of department heads. (CNS & General BU, HR Department)
- Support administration for document preparation such as open letter, honorarium, sponsorship.
- Track and record contract expiry and renewal dates.
- Manage the internal document sign-off process and maintain organized filing systems.
- Arrange logistics and venue setup for internal meetings, training, and corporate events.
- Maintain PR-PO records in an organized manner.

3. Event & Campaign (Logistics arrangement)
- Manage travel request forms, approval processes and related documentation. Arrange travel bookings (flight, hotel, visa).
- Track travel expenses and support reimbursement processes in line with SOP.
- Assist Brand teams in executing HCPs-related events and materials preparation.

4. Reporting & Supervision
- Coordinate with Demand Planning Executive in managing promotional campaigns, including customer data consolidation and preparation of spa policy.
- Provide guidance, assign tasks, monitor execution, compliance and consolidate reports from the Hanoi office.
- Act as a single point of contact for admin-related audits, SOP implementation.
- Consolidate and review monthly reports from both offices, including office expenses, travel costs, and PR/PO records.
- Organize and lead monthly cross-office admin meetings; collect feedback and propose improvement initiatives.",Mức độ phù hợp và xếp hạng của bạn so với ứng viên khác như thế nào?,,,,,,,,,,,,,,,,,"Hành Chính Văn Phòng, Hành Chính, Dược phẩm, Administrative Support, Documentation, Office Operations, Finance, business administation, CÔNG TY TNHH EISAI VIỆT NAM, Hồ Chí Minh"
General Accountant,The Grand Ho Tram,Thương lượng,"Ấp Hồ Tràm, Xã Hồ Tràm, Thành phố Hồ Chí Minh, Việt Nam., Ho Tram Hamlet, Ho Tram Commune, HCMC, Vietnam","• Cross-check the legality and accuracy of data and information on accounting documents;
Kiểm tra tính pháp lý và chính xác của thông tin và dữ liệu trên chứng từ kế toán;
• Prepare daily journal entries; make sure them to be properly recorded;
Hạch toán các nghiệp vụ kế toán phát sinh hằng ngày, đảm bảo tính chính xác;
• Co-operate with AP, and admin to control petty cash and employee advance;
Hợp tác với kế toán thanh toán và thư ký bộ phận để kiểm soát quỹ tiền mặt và tạm ứng của nhân viên;
• Prepare monthly tax report including VAT, SST, FCT and support in regular tax audit;
Lập báo cáo thuế hàng tháng bao gồm thuế GTGT, TTDB, thuế nhà thầu và hỗ trợ công việc khi có thanh tra thuế;
• Assist in year-end counting of fixed assets;
Hỗ trợ trong việc kiểm kê tài sản cuối năm;
• In-charge in allocating prepaid expenses, and prepare accrual list for month-end closing;
Chịu trách nhiệm phân bổ chi phí trả trước hàng tháng, và lên danh sách các chi phí trích trước cho việc đóng sổ cuối tháng;
• Prepare and monitoring expenses report incurred and matching with budget, as well as expenses analysis;
Thực hiện báo cáo chi phí và theo dõi dự toán, cũng như thực hiện phân tích chi phí;
• Provide financial support to other teams as required;
Hỗ trợ các nhóm khác trong công việc khi có yêu cầu;
• Maintain accounts receivable customer files and records for historical purpose;
Duy trì các hồ sơ khách hàng cho mục đích truy xuất dữ liệu quá khứ;
• Perform other duties assigned by the superior.
Thực hiện các nhiệm vụ khác do cấp trên giao.",Mức độ phù hợp và xếp hạng của bạn so với ứng viên khác như thế nào?,,,,,,,,,,,,,,,,,"Kế Toán/Kiểm Toán, Kế Toán Tổng Hợp, Dịch vụ lưu trú/Nhà hàng/Khách sạn/Du lịch, Chứng Từ Kế Toán, Báo Cáo Kinh Doanh, Hạch Toán Nghiệp Vụ, Kế Toán Tổng Hợp, Kiểm Tra Chi Phí, The Grand Ho Tram, Hồ Chí Minh"
