Title,Company,Salary,Location,Job Description,Job Requirements,Date Posted,Industry,Field,Experience,Education,Age,Vacancy,Work Time,Level,Skills,Language,Nationality,Gender,Marital Status,Work Date,Work Type,Keyword
Chuyên Viên Kế Toán (Tổng Hợp/doanh Thu),Công Ty Phát Triển Trạm Sạc Toàn Cầu V-Green,Thương lượng,"TechnoPark Tower, Vinhomes Ocean Park, Đa Tốn, Gia Lâm, Hà Nội, Việt Nam, Tòa Văn phòng Symphony, Đường Chu Huy Mân, Khu đô thị Vinhomes Riverside, Phường Phúc Lợi, Quận Long Biên, Thành phố Hà Nội, Việt Nam","1. Là đầu mối kết nối giữa HO và các thị trường nước ngoài; phối hợp làm việc với các bên liên quan.
2. Kế toán tổng hợp: Tổng hợp giao dịch, lập báo cáo tài chính và báo cáo quản trị; rà soát doanh thu, hoa hồng và doanh thu chia sẻ với đối tác.
3. Đối soát doanh thu giữa các hệ thống doanh thu đảm bảo ghi nhận đầy đủ, chính xác.
- Theo dõi, lập báo cáo công nợ phải thu, thu hồi công nợ quá hạn; rà soát chi phí chia sẻ doanh thu.
- Nắm vững chính sách kinh doanh, đề xuất phương án cài đặt trên hệ thống; lưu trữ hồ sơ và cung cấp báo cáo theo yêu cầu CBLĐ; thực hiện thanh kiểm tra và các nhiệm vụ phát sinh.","- Tốt nghiệp Đại học trở lên chuyên ngành Tài chính – Kế toán, Kinh tế, Kiểm toán; có ACCA/CFA/CPA là lợi thế.
- Tối thiểu 3 năm kinh nghiệm kế toán, kiểm toán, kiểm soát nội bộ (ưu tiên Big4, xây dựng, phát triển mạng lưới).
- Vững nghiệp vụ kế toán, phân tích – tổng hợp dữ liệu, lập báo cáo; hiểu biết tốt về luật thuế; chịu được áp lực công việc.
- Trách nhiệm cao, chủ động, quyết liệt; tư duy sáng tạo, cầu tiến; định hướng chất lượng và hiệu quả.
- Kỹ năng kiểm soát, phân tích, phối hợp công việc tốt; tinh thần dịch vụ; tiếng Anh giao tiếp tốt.",,,,,,,,,,,,,,,,,"Kế Toán/Kiểm Toán, Kế Toán Tổng Hợp, Vận tải, Tài Chính, Kế Toán, Bất Động Sản, Kiểm Toán, Công Ty Phát Triển Trạm Sạc Toàn Cầu V-Green, Hà Nội"
Marketing Executive,Perfetti Van Melle (Viet Nam) Limited,Thương lượng,"Vincom Center Đồng Khởi 72 Đ. Lê Thánh Tôn, Bến Nghé, Quận 1, Thành phố Hồ Chí Minh, Lot N, Street No.26, Song Than Industrial Zone No.2, Di An District, Binh Duong Province","Purpose of Role:
Assist Senior Brand Manager in implementing effective marketing activities and new
products development for assigned brands

Key Accountabilities/ Job Description:
1. To assist Senior Brand Manager in executing Marketing activities for assigned Company’s brands,
including new products development and launching, brand communication, consumer and trade
promotions and other activities in accordance with Company’s and Brands’ strategies and guidelines.
2. To assist Senior Brand Manager in reviewing performance of assigned product ranges for monthly
commercial forums to support brand planning and execution with necessary changes if required.
3. To collaborate with relevant local departments and Group Marketing to ensure deliverables of the
assigned new products development and other brand campaigns on time in full.
4. To monitor and control marketing spending within assigned budget and ensure required administrative
documentation following Company’s procedure.",Mức độ phù hợp và xếp hạng của bạn so với ứng viên khác như thế nào?,21/12/2025,"Tiếp Thị, Quảng Cáo/Truyền Thông > Tiếp Thị",Hàng tiêu dùng,1,,,,,Nhân viên,"Brand Management, Communication, English, Marketing Development, Strategic Agility",Bất kỳ,Không giới hạn,,,,,"Tiếp Thị, Quảng Cáo/Truyền Thông, Tiếp Thị, Hàng tiêu dùng, Brand Management, Communication, English, Marketing Development, Strategic Agility, Perfetti Van Melle (Viet Nam) Limited, Hồ Chí Minh"
