Title,Company,Salary,Location,Job Description,Job Requirements,Date Posted,Industry,Field,Experience,Education,Age,Vacancy,Work Time,Level,Skills,Language,Nationality,Gender,Marital Status,Work Date,Work Type,Keyword
Admin Phòng Ứng Dụng Sản Phẩm (Application Administrator),"Công Ty TNHH Thiết Bị Minh Tâm (Mitalab Co., Ltd)",Thương lượng,"Tòa nhà Mitalab, 76 Giảng Võ, Phường Giảng Võ, Hà Nội, Tòa nhà Mitalab 76 Giảng Võ, Đống Đa, Hà Nội.","• Tiếp nhận các yêu cầu hỗ trợ (Service Request) từ các phòng Kỹ thuật, Kinh doanh và từ khách hàng; phân công cho nhân viên ứng dụng sản phẩm, đảm bảo thời gian xử lý và hiệu quả hỗ trợ khách hàng.
• Cập nhật thông tin khách hàng và danh sách phân chia địa bàn phụ trách cho nhân viên trong phòng.
• Tạo Phiếu dịch vụ (Service Form) và lịch thăm khách hàng cho nhân viên; theo dõi và đốc thúc việc thực hiện theo kế hoạch đã phân công.
• Tạo lịch làm việc và Phiếu dịch vụ (Service Form) liên quan đến các chương trình chuyển đổi phần mềm và xét nghiệm.
• Lập Phiếu dịch vụ (Service Form) đúng và kịp thời; kiểm tra và quản lý Phiếu yêu cầu dịch vụ (Service Request) dạng giấy; tổng hợp danh sách báo cáo các Service Request và Service Form không đạt, làm căn cứ đánh giá hiệu quả thực hiện công việc hàng tháng của nhân viên.
• Lập các báo cáo định kỳ và báo cáo phát sinh về tình hình hỗ trợ khách hàng, tình hình đào tạo và các công việc thực hiện trong phòng.
• Tổng hợp dữ liệu phục vụ đánh giá chỉ số hiệu quả công việc hàng tháng (Key Performance Indicators – KPIs).
• Chủ động tìm hiểu và cập nhật kiến thức chuyên môn và sản phẩm, phục vụ cho công tác hỗ trợ nội bộ và hỗ trợ khách hàng.
• Hỗ trợ xây dựng quy trình làm việc, biểu mẫu và các quy định nội bộ trong phòng.",Mức độ phù hợp và xếp hạng của bạn so với ứng viên khác như thế nào?,,,,,,,,,,,,,,,,,"Khoa Học & Kỹ Thuật, Kỹ Thuật Hóa Học, Dịch vụ Y tế/Chăm sóc sức khỏe, y, Dược, Công Nghệ Sinh Học, Admin, Dược Phẩm, Công Ty TNHH Thiết Bị Minh Tâm (Mitalab Co., Ltd), Hà Nội"
Marketing Specialist,Công Ty TNHH Giáo Dục Và Đào Tạo Vinacademy,Thương lượng,VinUniversity,"ABOUT VINUNIVERSITY
VinUniversity (VinUni: https://vinuni.edu.vn/) is the first private, not-for-profit Vietnamese university established based on international standards. The university integrates the models of excellent international universities with the unique cultural and economic characteristics of Vietnam, to make a breakthrough in Vietnamese higher education and to become a world-class university.

The University has built strategic collaborations with Cornell University and the University of Pennsylvania and Nanyang Technological University— a choice that speaks to our commitment to excellence, innovation in research and teaching, and to making a difference in the world.

VinUni comprises of College of Arts and Sciences; College of Business and Management; College of Engineering and Computer Science; and College of Health Sciences.

Every aspect of the University: its curricula, research, faculty, student body, facilities, and campus life, is being developed to meet the highest standards set by the world’s leading accrediting and ranking organizations, such as FIBAA, ABET, AACSB, AGCME-I, Quacquarelli Symonds (QS) and Times Higher Education (THE).

VinUni’s founding benefactor – Vingroup is one of the biggest private conglomerates in Asia with the largest market capitalization value in Vietnam. As a multisector corporation, Vingroup focuses on main areas: Industrials & Technology; Real Estate & Services; Social Enterprises. VinUni is proud to be a part of the Vingroup ecosystem, giving its students opportunities to connect with several high quality research institutes, pioneering companies (such as VinFast, Vinpearl, Vinmec, Vinschool, and Vinhomes) and an dynamic entrepreneurial ecosystem (such as VinVenture, VinMotion, and VinRobotics…).

In September 2024, VinUni became the youngest and fastest university in the world to achieve QS 5 stars, earning 5 stars in 9 categories: global engagement, good governance, program strength, academic development, teaching, employability, facilities, arts, and social impact. In October 2024, VinUni was appointed by UNESCO as the first and only UNESCO University Chair, focusing on Environmental Leadership, Cultural Heritage, and Biodiversity.

OPPORTUNITY

Marketing Specialist is responsible for setting up, implementing and managing the PR and branding strategy, various online and offline Marketing activities and events.

This special career opportunity is dedicated for people who are passionate about and keen on making breakthrough changes in the education sector of Vietnam in order to nurture the next generations of leaders for the 21st century and beyond.

POSITION RESPONSIBILITIES
Report to: Head of Marketing & Communication.

Promote VinUni brand through a host of online and offline media channels.
Plan and execute Marketing and PR plans, communication campaigns and implement them under guided direction and consultation.
Manage the official website and supervise vendors on SEO planning and execution.
Responsible for proposing concept and writing Marketing & PR materials, including but not limited to brochures, flyers…
Manage VinUni’s official presence on Facebook, LinkedIn, and the website, focusing on news, events, and announcements.
Support departments and colleges in communication for their events and initiatives across required channels.
Lead campus branding and decoration projects, including concept development, vendor coordination, and project management.
Lead a team of interns and collaborators to deliver communication tasks effectively.
Other assigned duties by the line manager.",Mức độ phù hợp và xếp hạng của bạn so với ứng viên khác như thế nào?,27/01/2026,"Tiếp Thị, Quảng Cáo/Truyền Thông > Tiếp Thị",Giáo dục/Đào Tạo,Không hiển thị,Không giới hạn,Không hiển thị,Không hiển thị,,Nhân viên,"Digital Marketing, SEO, Communication and negotiation skills, Marketing Design, Time Management",Bất kỳ,Không hiển thị,Không hiển thị,Không hiển thị,,Toàn thời gian,"Tiếp Thị, Quảng Cáo/Truyền Thông, Tiếp Thị, Giáo dục/Đào Tạo, Digital Marketing, SEO, Communication and negotiation skills, Marketing Design, Time Management, Công Ty TNHH Giáo Dục Và Đào Tạo Vinacademy, Hà Nội"
Insurance Advisor,Tenzing Pacific Services Ltd.,Thương lượng,"103 Phạm Viết Chánh, phường 19, Bình Thạnh, Thành phố Hồ Chí Minh, Việt Nam, 4F, 103 Pham Viet Chanh, Thanh My Tay Ward, HCMC","THE OPPORTUNITY: IS THIS FOR YOU?

Insurance isn’t for everyone. It requires the right mindset, resilience, strong social skills & financial motivation. However, for those with the drive to succeed, it is a steady, reliable industry teeming with opportunities.

At Tenzing Pacific Services, we don't just offer a job; we offer the chance to build a lucrative portfolio of clients that generates sustained annually renewable income.

If you are ready to take control of your earnings and grow with a tech-forward organization with an excellent reputation, we want to hear from you.

WHY TENZING PACIFIC?

We are proudly established as a trusted insurance broker in Southeast Asia with over 330+ 5-star Google reviews. We equip our team with the tools to win:
- State-of-the-Art Technology: Forget manual comparisons. Our best-in-class system and custom CRM allow you to instantly compare over 50+ local and international insurers in just one minute.
- International Culture: Join a fun, dynamic international team of 50+ people representing 10 different nationalities.
- Work Hard, Play Hard: We celebrate our wins with company events, happy hours, and annual trips.
- Focus on Sales: We have a dedicated support staff to manage billing, claims, and complex administrative issues, allowing you to focus purely on selling and advising.

Want to see what life at Tenzing Pacific is really like? Watch our story here: https://shorturl.at/G0Q8w

WHY WORK FOR A BROKER?

People have different preferences, budgets & requirements. So why restrict yourself (and your income) to a single provider? That’s bad business. As a broker:
- Doesn’t cost the clients anything more
- Can offer providers like Bao Viet, PVI, Allianz, Liberty, April, Allianz, Luma, Cigna
- Our in-house comparison technology gives you a competitive advantage
- Short sales cycles & higher closing ratios = financial security

WE WANT TO HEAR FROM YOU IF

You understand that insurance is not a get-rich-quick scheme; it is a long-term game where you build your book & reputation over time.

This industry rewards those with the right sales DNA that allows you to achieve true financial independence, support yourself & your family, save money and enjoy holidays across Asia and Europe or wherever you’ve always wanted to go.

KEY RESPONSIBILITIES

Relationship Manager (70%)
- Engage with inbound leads
- Knock out your KPIs (& commissions) if you find your own leads
- Perform consultations and present tailored quotes using our advanced quoting system. Explain the good & bad, help people choose the right provider & plan for their unique circumstances

Customer Service (30%)
- Act as the main point of contact for client inquiries.
- Manage annual insurance renewals to secure your recurring income.
- Delegate administrative tasks to our in-house customer service team.

COMPENSATION & BENEFITS

We offer a structure designed to reward high performers:
- Base Salary: 8,000,000 – 14,000,000 VND (based on skills/experience).
- Uncapped Commission: Competitive structure with unlimited earning potential. Experienced advisors routinely earn 50-150M/ month, that doesn’t happen overnight. It comes with time, renewals & building a portfolio
- Passive Income: Annual renewal commissions for sustained income growth.
- Allowances: 2,000,000 VND (Lunch + Petrol).
- Work-Life Balance: Monday – Friday schedule with up to 15.5 days of annual leave plus public holidays.
- Growth: Ongoing professional development and training.",Mức độ phù hợp và xếp hạng của bạn so với ứng viên khác như thế nào?,,,,,,,,,,,,,,,,,"Kinh Doanh, Bán Hàng/Phát Triển Kinh Doanh, Bảo hiểm, Sales Training, Customer Service, General Communication English, Relationship Management, Outgoing Personality, Tenzing Pacific Services Ltd., Hồ Chí Minh"
Sales Training Supervisor,Shinhan Vietnam Finance Company Limited,Thương lượng,"8/F. Lottery Tower. 77 Tran Nhan Ton. D.5. HCMC. Vietnam, 19F, 15 Tran Bach Dang, Thu Thiem, Thu Duc City, Ho Chi Minh City","I. Job Summary:
The Sales Training is responsible for managing, delivering, and improving our sales training
programs. This role involves coaching, program assessment, and frequent travel for insights into
our business. Collaboration with the Sales Training Manager is key to developing effective
training programs.
II. Key Roles & Responsibilities
1. Training Program Management:
• Responsible for delivery to ensure the relevant sales training programs in plan;
• Provide coaching for new/revised training to key line trainers, observe & provide
feedback for key line trainer in sales training programs;
• Measure sales training programs qualification and training result;
• Frequent travel is required per month.
• Conduct training need analysis for sales and relevant training programs;
2. Training Delivery and Support:
• Deliver sales & relevant training programs;
• Demo, coach to enable line trainers to conduct relevant sales training programs;
• Observe and provide feedback to line trainer for relevant sales training programs;
• Participate in developing sales and relevant training programs for sales;
• Join field work to understand the business and gain more insights for training;
3. Training Program Development:
• Develop new training materials and assessment tools for training evaluation;
• Participate in Training projects & other assignments from Sales Training Manager.
• Any other tasks",Mức độ phù hợp và xếp hạng của bạn so với ứng viên khác như thế nào?,27/01/2026,Nhân Sự/Tuyển Dụng > Đào Tạo Và Phát Triển,Giáo dục/Đào Tạo,2,Cử nhân,Không hiển thị,1,9:00 - 18:00,Nhân viên,N/A,Bất kỳ,Không giới hạn,Bất kỳ,Bất kỳ,T2 - T6,Toàn thời gian,"Nhân Sự/Tuyển Dụng, Đào Tạo Và Phát Triển, Giáo dục/Đào Tạo, Shinhan Vietnam Finance Company Limited, Hồ Chí Minh"
Customer Service Officer (Chinese),"Kln Integrated Logistics (Viet Nam) Co., Ltd.",Thương lượng,"Số 20, Đại Lộ Thống Nhất, Khu công nghiệp Sóng Thần 2, Phường Dĩ An, Thành Phố Dĩ An, Tỉnh Bình Dương, Việt Nam (Cổng số 3), Tân Bình - Bình Thạnh - Thủ Đức, Đường Số 18, KCN Sóng Thần, An Bình, Dĩ An, Binh Duong, Vietnam","- Perform all transactions in the system for both export and import processes
- Prepare and manage all documents on cycle inventory, delivery of goods, orders from the shipping unit, store all soft and hard copy records
- Communicate and exchange with customers via email/phone to conduct transactions on the system
- Receive, handle arising problems, analyze and advise appropriate solutions to solve problems and satisfy customers.
- Support the completion of Service List (debit notes) & order requests for raw materials, supplies
- Other tasks assigned by Team Leader or Warehouse Supervisor",Mức độ phù hợp và xếp hạng của bạn so với ứng viên khác như thế nào?,27/01/2026,Hậu Cần/Xuất Nhập Khẩu/Kho Bãi > Xuất Nhập Khẩu & Thủ Tục Hải Quan,Hậu cần/Giao nhận,1,Không giới hạn,Không hiển thị,Không hiển thị,,Nhân viên,"Chinese, communication, Computer Skills",Bất kỳ,Không hiển thị,Không hiển thị,Không hiển thị,,Toàn thời gian,"Hậu Cần/Xuất Nhập Khẩu/Kho Bãi, Xuất Nhập Khẩu & Thủ Tục Hải Quan, Hậu cần/Giao nhận, Chinese, communication, Computer Skills, Kln Integrated Logistics (Viet Nam) Co., Ltd., Bình Dương, Hồ Chí Minh"
Employer Branding Officer,CÔNG TY TNHH DE HEUS,Thương lượng,,,,,,,,,,,,,,,,,,,,"Tiếp Thị, Quảng Cáo/Truyền Thông, Quản Lý Thương Hiệu, Nông nghiệp/Lâm nghiệp/Nuôi trồng thủy sản, Communication, Content Marketing, Creative, Creative, Creative, Creative, Design, Employer Branding, CÔNG TY TNHH DE HEUS, Hồ Chí Minh"
HR Senior Staff (Acting Manager) Training / Operations,International Business Center Company Limited,Thương lượng,"34 Le Duan St., Saigon ward, HCM City, Diamond Plaza, 34 Le Duan St","KEY RESPONSIBILITIES

1. Training Focus – Định hướng Đào tạo
- Xây dựng, triển khai và cập nhật kế hoạch đào tạo định kỳ cho các bộ phận vận hành tòa nhà và trung tâm thương mại theo định hướng của Công ty.
Develop, implement, and regularly update training plans for building and shopping mall operation teams in line with company direction.
- Tổ chức các chương trình đào tạo nội bộ như dịch vụ khách hàng, an toàn – PCCC, SOP vận hành, kỹ năng quản lý và kỹ năng mềm.
Organize internal training programs including customer service, safety & fire prevention, operational SOPs, management skills, and soft skills.
- Phối hợp với các phòng ban và đơn vị đào tạo bên ngoài để triển khai các khóa đào tạo bắt buộc, đào tạo chuyên môn và đào tạo tuân thủ.
Coordinate with internal stakeholders and external training providers for mandatory, technical, and compliance training programs.
- Theo dõi, đánh giá hiệu quả đào tạo thông qua phản hồi, kết quả kiểm tra và hiệu suất công việc sau đào tạo.
Monitor and evaluate training effectiveness through feedback, assessments, and post-training performance.
- Quản lý hồ sơ đào tạo, báo cáo đào tạo và đề xuất cải tiến chương trình đào tạo phù hợp với thực tế vận hành.
Manage training records, reports, and propose improvements to training programs based on operational needs.

2. Operations Focus (Định hướng Vận hành)
- Quản lý và kiểm soát các quy trình HR vận hành bao gồm chấm công, hợp đồng lao động, kỷ luật lao động và tuân thủ nội quy.
Manage and control HR operational processes, including attendance, labor contracts, employee discipline, and internal compliance.
- Phối hợp chặt chẽ với các phòng ban trong việc xử lý các vấn đề nhân sự phát sinh hằng ngày tại công ty
Coordinate with other departments to address daily HR issues as they arise
- Hỗ trợ triển khai hệ thống KPI, đánh giá hiệu suất định kỳ và theo dõi việc thực hiện các chính sách nhân sự.
Support KPI implementation, periodic performance evaluations, and monitoring of HR policy compliance.
- Tham gia xử lý các vấn đề quan hệ lao động, khiếu nại, và hỗ trợ duy trì môi trường làm việc ổn định.
Participate in employee relations cases, complaints handling, and support a stable working environment.

3. Report & Management ( Báo cáo và quản lý công việc)
- Lập báo cáo về việc triển khai các chương trình đào tạo, quy trình đào tạo và các chi phí phát sinh liên quan
Prepare reports on training programs implementation, training procedures, and related costs.
- Quản lý, cập nhật liên tục các điều luật liên quan tới người Lao Động
Monitor and regularly update labor laws and regulations related to employees.
- Báo cáo kịp thời các vấn đề phát sinh liên quan tới quản lý lao động để tìm hướng giải quyết hài hòa giữa Đại diện công ty và người lao động
Timely report of labor-related issues and propose appropriate solutions to ensure harmony between the Company and employees.
- Phối hợp kiểm tra các chi trả về quyền lợi của người Lao động (lương, thưởng, phúc lợi...)
Coordinate to review and monitor employee benefits payments, including salary, bonus, and welfare.",Mức độ phù hợp và xếp hạng của bạn so với ứng viên khác như thế nào?,27/01/2026,Nhân Sự/Tuyển Dụng > Đào Tạo Và Phát Triển,Bất Động Sản/Cho thuê,3,Cử nhân,Không hiển thị,Không hiển thị,08:00 - 17:30,Trưởng phòng,"Compliance Training, Employee Relations, HR Operations, Labor Law, Handling Complaints, Employee Relations, Handling Complaints, HR Operations, HR Operations, HR Operations",Tiếng Anh,Không hiển thị,Không hiển thị,Không hiển thị,T2 - T6,Toàn thời gian,"Nhân Sự/Tuyển Dụng, Đào Tạo Và Phát Triển, Bất Động Sản/Cho thuê, Compliance Training, Employee Relations, HR Operations, Labor Law, Handling Complaints, Employee Relations, Handling Complaints, HR Operations, HR Operations, HR Operations, International Business Center Company Limited, Hồ Chí Minh"
Senior Accounting Manager (6 Months Contract),"Kln Integrated Logistics (Viet Nam) Co., Ltd.",Thương lượng,,,,,,,,,,,,,,,,,,,,"Kế Toán/Kiểm Toán, Kế Toán Quản Trị, Hậu cần/Giao nhận, Accounting Management, Tax Accounting, Audit, Kln Integrated Logistics (Viet Nam) Co., Ltd., Bình Dương, Hồ Chí Minh"
Sales Specialist,"Dachser Vietnam Co., Ltd",Thương lượng,"09th Floor, 01 Dinh Le, Dinh Le Building, Ward 13, District 4, HCMC, DACHSER Vietnam Co., Ltd. 9th Floor, Dinh Le Building, No.1 Dinh Le, Ward 13, District 4, Ho Chi Minh City, Vietnam.","Handle customer enquiries, quotations and overseas agent correspondence and offering solutions to support Sales Team members across all branches when needed
• Support Sales team members across all branches in case of disputes or escalations from the customers by coordinating the escalation with related parties
• Understand customer needs and recommend appropriate solutions, enabling customers to enjoy the full benefits of our comprehensive range of products and services
• Ensure customer satisfaction and retention
• Ensure a support across different customer segmentation in Vietnam. E.g. there can be a split expected across locally controlled business (e.g. Friwo, St. Johns Packaging, Tekcom, etc.), but as well support to KAM accounts (e.g. Carrier, Brenntag, Gea, Otis, etc.).
• Trace cargo status, help to solve problems if incidents happen
• Provide comprehensive and professional services to customers, working to acquire, retain and develop relationships
• Consolidation of business information and costs for pricing/quotations
• Conduct Market research to identify new potential customers in the market and share the updated list with Management
• Maintain a team work/spirit relationship with Sales team and other related departments to achieve the set goals together
• CRM maintenance, ensuring the quality of data and account ownership. In addition, this shall include e.g. process issues during CIS changes and maintenance of expected business start dates.
• Training of newly joining Sales Supports
• Support in other Sales activities when requested
• Preparation of any supporting Sales Activities.",Mức độ phù hợp và xếp hạng của bạn so với ứng viên khác như thế nào?,27/01/2026,Hậu Cần/Xuất Nhập Khẩu/Kho Bãi > Xuất Nhập Khẩu & Thủ Tục Hải Quan,Hậu cần/Giao nhận,2,Không giới hạn,Không hiển thị,Không hiển thị,,Nhân viên,"Logistics Sales, Freight Forwarding, English/Vietnamese Communication, Support and Assistance",Tiếng Anh,Không hiển thị,Không hiển thị,Không hiển thị,,Toàn thời gian,"Hậu Cần/Xuất Nhập Khẩu/Kho Bãi, Xuất Nhập Khẩu & Thủ Tục Hải Quan, Hậu cần/Giao nhận, Logistics Sales, Freight Forwarding, English/Vietnamese Communication, Support and Assistance, Dachser Vietnam Co., Ltd, Hồ Chí Minh"
Financial Planning Officer - 1 Year contract,Shinhan Vietnam Finance Company Limited,Thương lượng,"The METT là 15 Trần Bạch Đằng, Phường An Khánh (hoặc Thủ Thiêm), TP. Thủ Đức, TP. Hồ Chí Minh, 19F, 15 Tran Bach Dang, Thu Thiem, Thu Duc City, Ho Chi Minh City","I. Key Roles & Responsibilities
a. Performance Management:
• Deliver the regular business performance tracking and analysis to provide insightful
business findings and recommendations to senior management.
• Budget and expense analysis, as well as coordinating with relevant departments to
understand any variances to monitor expense tracking against budget at company
level and department level.
• Monitor the business performance dashboard, liaise with relevant departments to find
out drivers/rationale of movements and highlight to line manager if any issues.
b. Planning
• Participate in the annual budget and business plan at company and departmental
level.
• Perform the rolling forecast on regular basis.
• Perform scenario analysis to monitor expected outcomes and prepare corrective
actions.
c. Reporting / Portfolio Analysis
• Prepare and improve the automation of yearly/ quarterly / monthly managerial
reports.
• Perform gap analysis and highlight insights to line manager.
• Develop and maintain profitability model by branches, vintages, channels, products,
segments, etc.
• Perform ad-hoc studies / reports as assigned by direct line manager
d. Other functions
• Provide financial data for stakeholders’ decision making
• Provide solution for automation workflow within department
• Back-up resources other peers in department",Mức độ phù hợp và xếp hạng của bạn so với ứng viên khác như thế nào?,,,,,,,,,,,,,,,,,"Ngân Hàng & Dịch Vụ Tài Chính, Phân Tích & Báo Cáo Tài Chính, Tài Chính, Budget Management, Budget Management, Communication Skills, Financial Analysis, MS Office, SAS, Shinhan Vietnam Finance Company Limited, Hồ Chí Minh"
