Title,Company,Location,Job Description,Job Requirements,Date Posted,Industry,Field,Experience,Education,Vacancy,Work Time,Level,Skills,Language,Nationality,Gender,Work Date,Work Type,Keyword,Industry1,Age Min,Age Max,salary_avg_vnd,salary_mins,salary_maxs
Quản lý Quy Hoạch (English),Công Ty Cổ Phần Đầu Tư Văn Phú - Invest,"Tòa nhà Văn Phú - Số 104 Thái Thịnh - Trung Liệt - Đống Đa - Hà Nội, Tòa nhà Văn Phú - Số 104 Thái Thịnh - Trung Liệt - Đống Đa - Hà Nộiội","Tuyển dụng 2 vị trí
- 1 vị trí Ưu tiên kinh nghiệm Chủ trì Thiết kế Quy hoạch các dự án lớn, Dự án BT và hình thức PPP
- 1 vị trí Chuyên viên chính Quy hoạch BĐS Khu đô thị và Nghỉ dưỡng, biết English

1. QUẢN LÝ THIẾT KẾ:
• Lập trình phê duyệt kế hoạch thiết kế. Kiểm soát kế hoạch thiết kế sau khi được phê duyệt;
• Lập nhiệm vụ thiết kế các giai đoạn;
• Tổ chức lựa chọn tư vấn thiết kế;
• Đánh giá chất lượng, sản phẩm của tư vấn, đề xuất thanh toán, quyết toán các hợp đồng với tư vấn thiết kế, tư vấn khảo sát;
• Quản lý và kiểm soát hồ sơ thiết kế các bộ môn Quy hoạch, Cảnh quan từ giai đoạn thiết kế Ý tưởng đến giai đoạn lập hồ sơ thiết kế BVTC. Đảm bảo các hồ sơ thiết kế đúng kế hoạch, đạt chất lượng và tuân thủ các quy định chung của Nhà nước; các quy định riêng của từng địa phương; các tiêu chí về thương hiệu sản phẩm của VPI và Guideline của đơn vị quản lý;
• Tổ chức cung cấp hồ sơ thiết kế phục vụ các công các pháp lý, thi công;
• Tổ chức phản hồi thông tin, điều chỉnh thiết kế trong giai đạn thi công;
• Các công việc khác theo sự phân công của Lãnh đạo Ban.
2. ĐIỀU PHỐI CÔNG VIỆC:
a. Phối hợp nội bộ Ban Quản lý thiết kế:
• Là đầu mối lập, kiểm soát, quản lý các hồ sơ quy hoạch từ quy hoạch chung, quy hoạch phân khu, quy hoạch chi tiết đảm bảo theo đúng các Quy chuẩn, tiêu chuẩn;
• Chịu trách nhiệm chính trong việc kiểm soát kế hoạch, tiến độ của Dự án được giao;
• Phối hợp với các thành viên trong Nhóm (Phòng) Kiến trúc, Quy hoạch, Kết cấu, MEP, Hạ tầng, Kinh tế và bộ phận khác liên quan trong Ban Quản lý Thiết kế để đảm bảo hoàn thành và nâng cao hiệu quả công việc của cá nhân và của Dự án được giao phụ trách.
b. Phối hợp với các Phòng, Ban, Đơn vị thành viên
• Đầu mối phối hợp các Ban, Đơn vị thành viên trong việc nghiên cứu định hướng đầu tư, chủ trương đầu tư nội bộ, lập nhiệm vụ quy hoạch... theo quy trình đã được phê duyệt.
• Là đầu mối tổng hợp thông tin, báo cáo, giải trình, cung cấp hồ sơ vv... liên quan đến công tác thiết kế Dự án, phục vụ từ giai đoạn pháp lý đến thi công và hoàn thành bàn giao công trình.
3. BÁO CÁO:
• Nhận chỉ đạo và báo cáo thường xuyên cho Lãnh đạo Ban Quản lý thiết kế về Dự án theo yêu cầu công việc
• Báo cáo xin ý kiến chỉ đạo của Lãnh đạo Ban Quản lý thiết kế về chuyên môn thiết kế khi cần hỗ trợ.
• Báo cáo định kỳ tuần/tháng/năm cho Lãnh đạo Ban đối với Dự án được giao phụ trách (bằng mẫu BC tuần/tháng/năm của Cty)
4. TUÂN THỦ:
• Nhận sự quản lý hành chính; Nhận và báo cáo kết quả thực hiện KPI từ Giám đốc Ban.","1. Bằng cấp tối thiểu: Tốt nghiệp đại học trở lên chuyên ngành kiến trúc tại các trường Đại học Kiến trúc, Xây dựng...
2. Kinh nghiệm tối thiểu 3 năm ở vị trí Quy hoạch vai trò CĐT các dự án Khu đô thị, Nghỉ dưỡng
Hoặc Kinh nghiệm Chủ trì Quy hoạch siêu dự án lớn, Dự án BT, hình thức Dự án PPP
Ưu tiên có năng lực về Phát triển Dự án
3. Chứng chỉ/giấy phép hành nghề: Khuyến khích
4. Trình độ ngoại ngữ: là lợi thế nếu Tiếng Anh trình độ TOEIC 600 điểm trở lên (hoặc điểm các chứng chỉ khác tương đương).
5. Trình độ tin học: Sử dụng thành thạo các phần mềm tin học văn phòng và các phần mềm đồ họa: Autocad, Sketchup, Photoshop... Khuyến khích sử dụng AI hỗ trợ thiết kế ý tưởng
6. Phẩm chất cá nhân: Trung thực, nhiệt huyết và quyết liệt.
7. Yêu cầu khác:
- Tuổi: 35-45.
- Khả năng quản lý, điều hành công việc tốt.
- Năng động, sáng tạo, xử lý thông tin nhanh, chịu áp lực công việc.
- Kỹ năng trình bày, thuyết trình tốt.
- Có kinh nghiệm làm việc với các CQNN, cơ quan chuyên ngành trong lĩnh vực quản lý quy hoạch.
- Sẵn sàng đi công tác khi có yêu cầu.
- Kỹ năng thiết kế: Có khả năng tự triển khai hồ sơ quy hoạch khi cần.",2025-08-23,Kiến Trúc/Xây Dựng,Bất Động Sản/Cho thuê,5,Cử nhân,2,08:15 - 17:30,Trưởng phòng,"Kiếm Soát Thiết Kế, Phát Triển Dự Án, Quy Hoạch Kiến Trúc, Quy Hoạch Thiết Kế, Thiết Kế Quy Hoạch Hệ Thống Hạ Tầng Đô Thị",Tiếng Việt,Không giới hạn,Bất kỳ,Thứ 2  đến Thứ 6,Toàn thời gian,"Kiến Trúc/Xây Dựng, Thiết Kế & Quy Hoạch Đô Thị, Bất Động Sản/Cho thuê, Kiếm Soát Thiết Kế, Phát Triển Dự Án, Quy Hoạch Kiến Trúc, Quy Hoạch Thiết Kế, Thiết Kế Quy Hoạch Hệ Thống Hạ Tầng Đô Thị, Công Ty Cổ Phần Đầu Tư Văn Phú - Invest, Hà Nội",Thiết Kế & Quy Hoạch Đô Thị,32,45,37500000.0,30000000.0,45000000.0
Trưởng Bộ Phận Tài Chính (Financial Planning & Analysis Manager),Onelab,"509-515 Đường Tô Hiến Thành, Quận 10, Hồ Chí Minh, Việt Nam, Tô Hiến Thành, Quận 10, Thành phố Hồ Chí Minh","Lập kế hoạch tài chính:
• Dự báo doanh thu, chi phí và lợi nhuận cho các bộ phận Kinh doanh, Telesales,… và toàn công ty.
• Hỗ trợ xây dựng kế hoạch đầu tư cho các dự án dịch vụ y tế như mở rộng cơ sở, phòng khám.
• Đánh giá hiệu quả hoạt động tài chính, phân tích chi phí, lợi nhuận, dòng tiền và các chỉ số tài chính.
Lập kế hoạch ngân sách:
• Xây dựng và giám sát ngân sách hàng năm, dự báo tài chính ngắn hạn và dài hạn.
Kiểm soát tài chính và tuân thủ:
• Đảm bảo các hoạt động tài chính tuân thủ theo kế hoạch, chính sách, định mức đã được phê duyệt.
• Phối hợp với kế toán để kiểm tra, đối chiếu số liệu và báo cáo tài chính.
• Báo cáo tài chính: Chuẩn bị báo cáo định kỳ hàng tháng.
Tư vấn chiến lược giá:
• Đề xuất chính sách giá phù hợp với từng nhóm đối tượng bệnh nhân (bảo hiểm y tế, dịch vụ, khám theo yêu cầu.
• Phân tích tác động của thay đổi giá đến khả năng cạnh tranh và hiệu quả tài chính.
• Đưa ra các giải pháp tài chính giúp các bộ phận, công ty đạt mục tiêu kinh doanh.
Thẩm định đầu tư, hợp tác:
• Đánh giá tính khả thi của các dự án đầu tư, hợp đồng dịch vụ với khách hàng, lợi nhuận, chí phí, đề xuất phương án tài chính phù hợp","1. Trình độ học vấn
Tốt nghiệp Đại học trở lên chuyên ngành Tài chính, Kế toán, Kiểm toán, Kinh tế, Quản trị Kinh doanh.
Ưu tiên ứng viên có chứng chỉ: CFA, ACCA, CPA, CMA hoặc tương đương
2. Kinh nghiệm
5–8 năm kinh nghiệm trong lĩnh vực Tài chính doanh nghiệp / Phân tích tài chính (FP&A) / Kiểm soát tài chính / Kế toán quản trị.
Ít nhất 2–3 năm ở vị trí quản lý hoặc trưởng nhóm tài chính.
Có kinh nghiệm làm việc trong lĩnh vực Healthcare, Manufacturing, Tech là lợi thế.
Có kinh nghiệm tham gia hoặc dẫn dắt các dự án dự báo tài chính, hoạch định chiến lược, thẩm định đầu tư, M&A.

3. Kiến thức & kỹ năng
Thành thạo lập kế hoạch tài chính, dự báo, ngân sách, phân tích chi phí – lợi nhuận, P&L, cash flow, balance sheet.
Kinh nghiệm trong thẩm định đầu tư, phân tích ROI, phân tích kịch bản (scenario planning).
Có tư duy chiến lược, khả năng kết nối dữ liệu tài chính với định hướng kinh doanh.
Ra quyết định nhanh, xử lý tình huống & quản trị rủi ro.",2025-08-23,Ngân Hàng & Dịch Vụ Tài Chính,Dịch vụ Y tế/Chăm sóc sức khỏe,5,Cử nhân,Không hiển thị,,Trưởng phòng,"Finance Management, Accounting & Finance, Finance Business Partnering, M&A Strategy",Bất kỳ,Không hiển thị,Không hiển thị,,Toàn thời gian,"Ngân Hàng & Dịch Vụ Tài Chính, Phân Tích & Báo Cáo Tài Chính, Dịch vụ Y tế/Chăm sóc sức khỏe, Finance Management, Accounting & Finance, Finance Business Partnering, M&A Strategy, Onelab, Hồ Chí Minh",Phân Tích & Báo Cáo Tài Chính,0,100,,,
Trưởng Phòng Kế toán Thuế Tập đoàn,Công Ty Cổ Phần Đầu Tư Văn Phú - Invest,"Tòa nhà Văn Phú - Số 104 Thái Thịnh - Trung Liệt - Đống Đa - Hà Nội, Tòa nhà Văn Phú - Số 104 Thái Thịnh - Trung Liệt - Đống Đa - Hà Nộiội","1. Mô tả công việc: Tương đương vị trí Phụ trách Kế toán thuế Tập đoàn
• Lập kế hoạch thuế năm, điều chỉnh kế hoạch thuế, đề xuất cấu trúc doanh thu và mô hình quản lý chi phí của hệ thống, đề xuất cấu trúc công ty để phù hợp với kế hoạch thuế tối ưu và tổ chức thực hiện kế hoạch thuế sau khi kế hoạch thuế được phê duyệt.
• Tham gia thẩm định kế hoạch ngân sách thuế của các công ty trong hệ thống, đánh giá tình hình thực hiện kế hoạch thuế hàng tháng, hàng quý, bán niên và hàng năm của hệ thống.
• Tham gia thẩm định quyết toán thuế năm của các công ty.
• Lập tờ khai và nộp tiền thuế các loại.
• Tham gia thẩm định nghĩa vụ thuế phát sinh từ các giao dịch (M&A, BCC, Chuyển nhượng dự án, Chuyển nhượng cổ phần...), tham gia đàm phán cấu trúc các giao dịch lớn.
• Lên kế hoạch kiểm tra thuế công ty thành viên, thực hiện công tác kiểm tra thuế các công ty thành viên.
• Trực tiếp làm việc với cơ quan Thuế trong việc: đối chiếu số liệu nợ thuế, xác nhận hoàn thành nghĩa vụ thuế, giải trình các số liệu liên quan tới việc kê khai và nộp thuế;
• Tham gia thanh tra kiểm tra tình hình chấp hành nghĩa vụ thuế của DN.","• Tối thiểu 3 năm kinh nghiệm làm kế toán. Tốt nghiệp ĐH các chuyên ngành tài chính, kế toán, thuế, kiểm toán, 3 năm làm việc tại vị trí tương đương.
• Ưu tiên ứng viên đã có kinh nghiệm làm việc trong doanh nghiệp BĐS tối thiểu 3 năm. Ưu tiên ứng viên có chứng chỉ ACCA, CPA, đại lý thuế, kinh nghiệm Kế toán kiểm toán
• Có khả năng chủ động tổ chức, quản lý công việc độc lập.
• Am hiểu thủ tục, chế độ kế toán và luật thuế hiện hành;
• Giao tiếp tốt, ngoại hình ưu nhìn.",2025-08-23,Kế Toán/Kiểm Toán,Bất Động Sản/Cho thuê,3,Cử nhân,1,08:15 - 17:30,Trưởng phòng,"Giao Tiếp, Kế Toán, Kiểm Toán, Tài Chính, Thuế",Bất kỳ,Không giới hạn,Bất kỳ,Thứ 2  đến Thứ 6,Toàn thời gian,"Kế Toán/Kiểm Toán, Kế Toán Thuế, Bất Động Sản/Cho thuê, Giao Tiếp, Kế Toán, Kiểm Toán, Tài Chính, Thuế, Công Ty Cổ Phần Đầu Tư Văn Phú - Invest, Hà Nội",Kế Toán Thuế,30,40,,,
Chuyên Viên Tài Chính Cấp Cao (Financial Business Partner),Onelab,"509-515 Đường Tô Hiến Thành, Quận 10, Hồ Chí Minh, Việt Nam, Tô Hiến Thành, Quận 10, Thành phố Hồ Chí Minh","Phân tích chi phí và cấu trúc giá:
• Thu thập và phân tích chi phí trực tiếp (vật tư, nhân lực,...) và chi phí gián tiếp (khấu hao thiết bị, chi phí quản lý).
• Xây dựng bảng giá dịch vụ y tế theo các dịch vụ xét nghiệm, khám cho các đối tượng khách hàng.
• Tính toán giá bán sản phẩm dịch vụ (thiết bị, dịch vụ xét nghiệm...) dựa trên chi phí, biên lợi nhuận, và giá thị trường.
Lập kế hoạch tài chính:
• Dự báo doanh thu, chi phí và lợi nhuận cho các bộ phận và toàn công ty.
• Hỗ trợ xây dựng kế hoạch đầu tư cho các dự án dịch vụ y tế như mở rộng cơ sở, mua sắm thiết bị, hóa chất,….
Lập kế hoạch ngân sách:
• Xây dựng và giám sát ngân sách hàng năm, dự báo tài chính ngắn hạn và dài hạn.
Kiểm soát tài chính và tuân thủ:
• Đảm bảo các hoạt động tài chính tuân thủ theo kế hoạch, chính sách, định mức đã được phê duyệt.
• Phối hợp với kế toán để kiểm tra, đối chiếu số liệu và báo cáo tài chính.
• Theo dõi thu chi, đảm bảo dòng tiền ổn định và tối ưu hóa sử dụng vốn.
• Báo cáo tài chính: Chuẩn bị báo cáo định kỳ hàng tháng.","1. Trình độ học vấn
Tốt nghiệp Đại học trở lên chuyên ngành Tài chính, Kế toán, Kiểm toán, Kinh tế hoặc các ngành liên quan.
Ưu tiên ứng viên có chứng chỉ: CFA, ACCA, CPA, CMA hoặc tương đương

2. Kinh nghiệm
Tối thiểu 3–5 năm kinh nghiệm trong Phân tích tài chính / FP&A / Kiểm soát tài chính / Kế toán quản trị.
Có kinh nghiệm làm việc trong lĩnh vưc Healthcare, Manufacturing, Tech là lợi thế.
Khả năng làm việc trực tiếp với các phòng ban kinh doanh (Sales, Marketing, Product) để hỗ trợ ra quyết định.

3. Kiến thức & kỹ năng chuyên môn
Hiểu biết vững chắc về tài chính doanh nghiệp, lập ngân sách, dự báo, P&L, cash flow.
Có khả năng đọc hiểu báo cáo tài chính và phân tích các chỉ số KPI kinh doanh.
Kỹ năng lập kế hoạch tài chính ngắn hạn & dài hạn, phân tích rủi ro, thẩm định đầu tư.
Am hiểu về chiến lược giá và tác động đến lợi nhuận, thị phần.",2025-08-23,Ngân Hàng & Dịch Vụ Tài Chính,Dịch vụ Y tế/Chăm sóc sức khỏe,5,Cử nhân,Không hiển thị,,Nhân viên,"business analyst, Cost Models, Costing management, Finance Business Partnering, Finance Management",Bất kỳ,Không hiển thị,Không hiển thị,,Toàn thời gian,"Ngân Hàng & Dịch Vụ Tài Chính, Phân Tích & Báo Cáo Tài Chính, Dịch vụ Y tế/Chăm sóc sức khỏe, business analyst, Cost Models, Costing management, Finance Business Partnering, Finance Management, Onelab, Hồ Chí Minh",Phân Tích & Báo Cáo Tài Chính,0,100,,,
Giám Đốc Ban Chiến lược,Công Ty Cổ Phần Đầu Tư Văn Phú - Invest,"Tòa nhà Văn Phú - Số 104 Thái Thịnh - Trung Liệt - Đống Đa - Hà Nội, Tòa nhà Văn Phú - Số 104 Thái Thịnh - Trung Liệt - Đống Đa - Hà Nộiội","MÔ TẢ CÔNG VIỆC

1. Chiến lược phát triển tổng thể: Chủ trì nghiên cứu, xây dựng chiến lược phát triển trung – dài hạn cho Văn Phú và các đơn vị thành viên.
2. Định hướng sản phẩm – dịch vụ:
- Định hướng xu hướng phát triển sản phẩm – dịch vụ BĐS phù hợp với
xu thế thị trường và năng lực hệ sinh thái Văn Phú.
- Tham gia phản biện chiến lược sản phẩm của các dự án trọng điểm.
3. Định hướng đầu tư:
- Đánh giá và đề xuất vị trí, thị trường, tỷ suất đầu tư, loại hình sản
phẩm và khách hàng mục tiêu của từng dự án.
4. Quản lý vận hành đơn vị:
- Xây dựng kế hoạch hoạt động, ngân sách, định biên nhân sự hàng năm
cho Ban Chiến lược
- Tổ chức triển khai, giám sát và báo cáo kết quả hoạt động của toàn
Ban.
- Xây dựng và hoàn thiện quy trình, văn bản nội bộ phục vụ hoạt động
chuyên môn.
5. Các nhiệm vụ khác:
- Thực hiện các công việc khác theo phân công trực tiếp của Chủ tịch
HĐQT.","Yêu cầu:
- Bằng cấp : Tốt nghiệp Đại học trở lên chuyên ngành Kinh tế, Quản trị, Bất động sản, Chính sách công hoặc các ngành liên quan. Ưu tiên Thạc sĩ, MBA.
- Chứng chỉ hành nghề : Không yêu cầu
- Ngoại ngữ : Thành thạo tiếng anh
- Ứng dụng CNTT : Thành thạo tin học văn phòng và ứng dụng tốt công nghệ thông tin
trong công việc
- Kinh nghiệm : Tối thiểu 7 năm kinh nghiệm, trong đó có ít nhất 5 năm ở vị trí quản lý
tương đương, (TGĐ, PTGĐ các đơn vị đầu tư, tư vấn quản trị hoặc Giám đốc Chiến lược tại các công ty BĐS hoặc các tập đoàn đầu tư, đa ngành)
- Có kinh nghiệm trong việc xây dựng và triển khai chiến lược dài hạn cho các tập đoàn lớn, đảm bảo sự kết nối giữa các mục tiêu dài hạn của công ty và các chiến lược phát triển kinh doanh.
Yêu cầu bổ sung
- Độ tuổi : Từ 35 tuổi trở lên
- Phẩm chất cá nhân : Cẩn trọng, tỷ mỷ, nghiêm túc và quyết liệt trong công việc
- Kỹ năng/kiển thức bổ : Kiến thức sâu về chiến lược phát triển doanh nghiệp, thị trường BĐS,
trợ phân tích chính sách và xu hướng kinh tế – xã hội.
- Có khả năng nghiên cứu, quản lý và phát triển dự án;
- Kỹ năng giao tiếp tốt, kỹ năng đàm phán thuyết trình tốt;
- Kỹ năng tổng hợp và phân tích thông tin, lập kế hoạch và tổ chức thực hiện, phối hợp làm việc
nhóm tốt, phân tích và xử lý vấn đề;
- Kỹ năng tư duy hệ thống, tư duy chiến lược, năng lực phản biện chính
sách và quản lý điều phối hiệu quả.
- Khả năng giao tiếp và đàm phận tốt đặc biệt là với các nhà đầu tư, đối
tác chiến lược, và các cơ quan quản lý nhà nước.",2025-08-23,Ngân Hàng & Dịch Vụ Tài Chính,Bất Động Sản/Cho thuê,7,Cử nhân,1,08:15 - 17:30,Giám Đốc và Cấp Cao Hơn,"Hiệu Quả Dự Án, Khả Năng Ngoại Giao, Phân Tích Đầu Tư, Quản Lý Chiến Lược, Quản Trị Dự Án Đầu Tư",Tiếng Việt,Không giới hạn,Bất kỳ,Thứ 2  đến Thứ 6,Toàn thời gian,"Ngân Hàng & Dịch Vụ Tài Chính, Đầu Tư Tài Chính, Bất Động Sản/Cho thuê, Hiệu Quả Dự Án, Khả Năng Ngoại Giao, Phân Tích Đầu Tư, Quản Lý Chiến Lược, Quản Trị Dự Án Đầu Tư, Công Ty Cổ Phần Đầu Tư Văn Phú - Invest, Hà Nội",Đầu Tư Tài Chính,36,45,,,
Kế Toán Trưởng,Vietnamworks' Client,"509-515 Đường Tô Hiến Thành, Quận 10, Hồ Chí Minh, Việt Nam, Tô Hiến Thành, Quận 10, Thành phố Hồ Chí Minh","TỔ CHỨC CÔNG TÁC KẾ TOÁN
- Giữ vai trò Quản lý phòng Kế toán, chịu trách nhiệm tổ chức, vận hành hệ thống kế toán tuân thủ các quy chế, quy định của Công ty và pháp luật hiện hành
- Xây dựng các quy trình, quy chuẩn, biểu mẫu liên quan đến kế toán, tài chính. Thiết lập hệ thống báo cáo cho các phần hành chi tiết, đảm bảo thông tin, số liệu được cung cấp kịp thời, chính xác, phục vụ yêu cầu của công tác quản trị
- Thực hiện các công việc hạch toán kế toán, cập nhật lưu trữ chứng từ, kiểm tra, giám sát các khoản thu / chi tài chính; các nghĩa vụ thu nộp ngân sách nhà nước, thanh toán công nợ; quản lý sử dụng tài sản và nguồn hình thành tài sản
- Kiểm soát toàn bộ hồ sơ thanh toán, đảm bảo tính đầy đủ, hợp lý, hợp lệ, hợp pháp và đúng quy định.
- Làm việc với cơ quan thuế, thực hiện hoàn chỉnh công tác quyết toán thuế và kiểm toán;
- Cập nhật đầy đủ các quy định pháp luật và chế độ chính sách để thực hiện các công việc tài chính kế toán chuẩn mực, chính xác và đúng pháp luật.
- Thực hiện các công việc khác theo yêu cầu của Ban giám đốc.

THIẾT LẬP BÁO CÁO
- Lập báo cáo thuế (thuế GTGT, thuế TNDN, thuế TNCN) theo định kỳ báo cáo hàng quý, năm theo quy định. Lập báo cáo tài chính cuối năm tài chính.
- Lập ngân sách hoạt động và báo cáo tài chính hàng tháng và giải trình chi tiết theo yêu cầu của Ban giám đốc.
- Lập các biên bản, thông báo, báo cáo nội bộ chi tiết/tổng hợp nếu có yêu cầu từ Ban giám đốc.","• Đại học. Chuyên ngành ưu tiên: Kế toán/ Tài chính
• Ứng viên có từ 5 năm kinh nghiệm ở vị trí tương đương
• Ưu tiên các ứng viên có kinh nghiệm trong lĩnh vực Healthcare Service, phòng khám/ các công ty làm về chuỗi bán lẻ, công ty sản xuất
• Nắm vững kiến thức chuyên môn về kế toán tài chính, nắm vững chuẩn mực kế toán
• Tư duy và phân tích, tổng hợp số liệu
• Lập kế hoạch dài hạn, Giải quyết vấn đề
• Quản lý thời gian tốt, thông minh, nhạy bén
• Thành thạo các phần mềm văn phòng",2025-08-23,Kế Toán/Kiểm Toán,Dịch vụ Y tế/Chăm sóc sức khỏe,5,Cử nhân,Không hiển thị,,Trưởng phòng,"Kế Toán, Tài Chính, Chief Accountant Certificate, Finance",Bất kỳ,Không hiển thị,Không hiển thị,,Toàn thời gian,"Kế Toán/Kiểm Toán, Kế Toán Tài Chính, Dịch vụ Y tế/Chăm sóc sức khỏe, Kế Toán, Tài Chính, Chief Accountant Certificate, Finance, Vietnamworks' Client, Hồ Chí Minh",Kế Toán Tài Chính,0,100,,,
